_id,recipient,message,song_id,song_name,song_artist,song_image,created_at
672a02e8d1bdcae69adefe3c,damar,"Halo..
Its been a long time rite?
Jadi gimana harinya?

Sudah lama kita tidak bertemu, benar? Masihkah kamu merasa not good enough for everyone? Masihkah kamu membantu semua orang karena kamu tidak mampu membantu dirimu sendiri?
Kita berteman sudah cukup lama. Cukup lama untuk kita menyadari bahwa kita tidak pernah sepaham itu satu sama lain. Dibeberapa kesempatan, kita punya berbagai macam kesamaan yang membuat kita dekat karena kita merasa memahami satu sama lain, jadi mungkin itu yang membuat kita lupa, bahwa kita tidak pernah sepaham itu satu sama lain.",68FHdrL6dbruEBrfLjR52a,Paths,NIKI,https://i.scdn.co/image/ab67616d0000b2734d3d3963c551df56736050f1,2024-11-05T18:35:04.050359314+07:00
672a02bdd1bdcae69adef7cd,damar,"good night my darling, have a good rest, how's your day? how are you doing today? is there anything interesting today? come here and tell me, i also want to read about your daily life today, but i'm not forcing you to tell me, okay? today is bad for you, you have to be good to yourself, don't give up because today is not good, come on, be enthusiastic, there's still tomorrow, hopefully tomorrow will be a nice day for you, if you're really tired, just rest, it's already late.good luck yes darling, you've gone to sleep now have a nice dream babe. gamau banyak basa basi i just wanna say thank you for everything, mau ngucapin terima kasih banyak kalo bukan hadir nya kamu mungkin sampe sekarang aku gabakal tau adanya orang tulus, tulus sayang dan cinta sama aku yang banyak kurang nya, sampe detik ini aku juga bisa bertahan sama kamu, aku gapernah nyesel ketemu kamu, maaf kalo aku sering buat kesalahan sama kamu, tapi aku beneran tulus sama kamu, ga akan ada yang bisa tandingin cinta nya aku ke kamu. jangan keseringan ovt gajelas ya? buang jauh - jauh, kata kunci hubungan langgeng itu saling percaya, but kamu harus selalu percaya, aku juga percaya kalo kamu itu serius ga main” dan tolong yaa kalau ada apa apa yang bikin kamu risih atau hal yang gaa disukai dari aku bilang ajaa, aku bakal lakuin apapun ituu dari kamu.
i love u bby🫶🏻🤍~naa",4rHZZAmHpZrA3iH5zx8frV,Mirrors,Justin Timberlake,https://i.scdn.co/image/ab67616d0000b273db1d1cdc927a07825a2ed244,2024-11-05T18:34:21.127989959+07:00
672a0290d1bdcae69adef112,damar,miss uu ,7MYmo0JJJDmu4MZTSAF9y3,On Bended Knee,Boyz II Men,https://i.scdn.co/image/ab67616d0000b2736b3b28022871bae1a5d0f057,2024-11-05T18:33:36.212527339+07:00
672a0192d1bdcae69adecb16,damar,hai ka how are you? ,5enxwA8aAbwZbf5qCHORXi,All Too Well (10 Minute Version) (Taylor's Version) (From The Vault),Taylor Swift,https://i.scdn.co/image/ab67616d0000b273318443aab3531a0558e79a4d,2024-11-05T18:29:22.685360928+07:00
672a00a7d1bdcae69adea87c,damar,"kak ,aku syg bngt sama kmu ,semoga dunia dan Allah menyatukan kita selama lamanyaa ,semoga km balik kepelukan ku lagi ya 🤍",2plbrEY59IikOBgBGLjaoe,Die With A Smile,"Lady Gaga, Bruno Mars",https://i.scdn.co/image/ab67616d0000b27382ea2e9e1858aa012c57cd45,2024-11-05T18:25:27.658356782+07:00
672a0083d1bdcae69adea35e,damar,"Halloo damar! 
Aku ngga tau kamu bakal liat ini atau ngga tapi semoga kamu bahagia dengan seseorang yang ada disampingmu yaa!
Aku udah mulai lupain perasaan aku koo, tapi aku ngga akan lupa soal buryam di samping perpus haha  ",1fDFHXcykq4iw8Gg7s5hG9,About You,The 1975,https://i.scdn.co/image/ab67616d0000b2731f44db452a68e229650a302c,2024-11-05T18:24:51.979977747+07:00
6729ff51d1bdcae69ade77dd,damar,"halloooo, maaf ya aku suka ghosting kamu walau pun ak suka ghosting km tp hati aku ttp ke kamuu, plss tungguin aku yaa sampe aku bener² suka sama kamuuu☝🏻🫨👀",1Mza2sr6tPhy6jjI3HB9fW,Hold Me Down,Daniel Caesar,https://i.scdn.co/image/ab67616d0000b2733138f891f3075c9c5d944037,2024-11-05T18:19:45.71070071+07:00
6729ff4cd1bdcae69ade7731,damar,"ketikan lo jahat ajg, dikira ga sakit kali yaa, ga mikir perasaan cwe wkwkw, seganteng apa si lu monyet",3qhlB30KknSejmIvZZLjOD,End of Beginning,Djo,https://i.scdn.co/image/ab67616d0000b273fddfffec51b4580acae727c1,2024-11-05T18:19:40.911839342+07:00
6729ff0bd1bdcae69ade6da2,damar,"haii bagaimana harimu tanpa aku?? pasti baik"" aja ak sih harapannya jga begitu",4pvb0WLRcMtbPGmtejJJ6y,exile (feat. Bon Iver),"Taylor Swift, Bon Iver",https://i.scdn.co/image/ab67616d0000b27395f754318336a07e85ec59bc,2024-11-05T18:18:35.121556472+07:00
6729fe48d1bdcae69ade521b,damar,"is that you? kalo emang iya aku cuma mau bilang makasi uda sempet punya rasa sebesar itu ke aku, i hope you also find your happiness, kejar apa yang ingin kamu kejar selagi itu positif ya, semangat terus demi jadi nanuna wkwk",0e2wfbDK7ppotqyUWD7qs8,La La Lost You - Acoustic Version,"NIKI, 88rising",https://i.scdn.co/image/ab67616d0000b2738b0e2044b4b20f24908f7122,2024-11-05T18:15:20.533065548+07:00
6729fe10d1bdcae69ade4a10,damar,"semangat yo mas kerjo nyo, atii-ati bawa motor, jangan telat makan
gek kito samo² lagi yoo, keliling Jambi sambil nyanyi lagu ini.
sekarang kito ldr an dulu, lopyu:)",3pCt2wRdBDa2kCisIdHWgF,To the Bone,Pamungkas,https://i.scdn.co/image/ab67616d0000b2738540f1aa50ce035b4e9cdfa7,2024-11-05T18:14:24.397252426+07:00
6729fd21d1bdcae69ade2865,damar,kmuu ga kangen akuu?☹️,7MYmo0JJJDmu4MZTSAF9y3,On Bended Knee,Boyz II Men,https://i.scdn.co/image/ab67616d0000b2736b3b28022871bae1a5d0f057,2024-11-05T18:10:25.390775722+07:00
6729fc71d1bdcae69ade0f22,damar,"km gmw balik ke ak dam? i miss uu, kgn bgt bgt",6VggIDYOnf9C8fJVcMpxAu,Kangen,Dewa 19,https://i.scdn.co/image/ab67616d0000b27370ea19fd1f517d40b9c01c0d,2024-11-05T18:07:29.826714139+07:00
6729fbbed1bdcae69addf5fb,damar,Mencintai dengan diamm,2wAiFWjRupWmnDkQcu91MF,Rumah Ke Rumah,Hindia,https://i.scdn.co/image/ab67616d0000b273d623688488865906052ef96b,2024-11-05T18:04:30.069067835+07:00
6729fbb8d1bdcae69addf534,damar,"setiap orang ada masanya,
setiap masa ada orang nya

by : serana",09eWF5r8kasfOEp8RFRQLv,Serana,For Revenge,https://i.scdn.co/image/ab67616d0000b27366de8f7224e459d2cc0f9a1f,2024-11-05T18:04:24.707498027+07:00
6729fb9bd1bdcae69addf0c9,damar,"halo damar?wkwk udh punya cewe baru yaa? selamat yaaa
aku cuma bisa ngeliat kamu ketawa bareng sama cewe mu,asik bgt ya? jadi keinget kita juga dulu kaya gitu yaa?bercanda, ngobrol,kamu traktir aku jajanan ,kasih aku coklat banyak dehhh 
jujur aku udh lupa sama kamu eh semesta punya cara untuk mempertemukan kita ya?tapi masa kamu sama aku udh habis
gapapa kokkk, semangat terus yaaa hihii i loved you",5KYUrBgdbIcqwaGSIgfXPl,Apa Mungkin,Bernadya,https://i.scdn.co/image/ab67616d0000b2738869d13091935994879f2a47,2024-11-05T18:03:55.412785155+07:00
6729fb40d1bdcae69adde419,damar,"hai damar, kamu adalah first experience aku, walaupun kamu bukan orang pertama yg pernah sama aku",7gB98EWp4p9VKxOToaqrhM,Cinta Terakhir,Ari Lasso,https://i.scdn.co/image/e850a6af940d44800207bd7cf5d2dbded6ca5c1e,2024-11-05T18:02:24.779023498+07:00
6729fa8cd1bdcae69addcac9,damar,"asing bgt, ga kangen apa?
",4nyF5lmSziBAt7ESAUjpbx,"I miss you, I’m sorry",Gracie Abrams,https://i.scdn.co/image/ab67616d0000b27355c38bc34d1fe852f2657c2e,2024-11-05T17:59:24.129044143+07:00
6729f9f8d1bdcae69addb659,damar,"halo kak, disini aku cuma mau bilang
maaf aku belum bisa move on, aku masih sering kangen kamu, entah kenapa tiap aku suka orang"" ujung ujungnya balik ke kamu lagi kak. hehe itu aja, semoga sehat selalu, i loved u ❤️‍🩹",13sOb9V6Y3uCnRxY9HIZqP,if u could see me cryin' in my room,"Arash Buana, raissa anggiani",https://i.scdn.co/image/ab67616d0000b2735f95e95fefcbafd47ffd6130,2024-11-05T17:56:56.611582927+07:00
6729f9efd1bdcae69addb52d,damar,hii damar k*nt0l aku kenal km dri game...,2U3jOPfO4wZZFaaWS4Dcj6,stranger,Olivia Rodrigo,https://i.scdn.co/image/ab67616d0000b2734063d624ebf8ff67bc3701ee,2024-11-05T17:56:47.230984098+07:00
6729f952d1bdcae69adda050,damar,"haii sayangg, aku harap di dunia yang rumit ini kita sama-sama terus selamanyaaa",0ROj512WvJ1eqeELd7MEdJ,Sampai Jadi Debu (Menampilkan Gardika Gigih),Banda Neira,https://i.scdn.co/image/ab67616d0000b273c1528165fd2e76da5331b48c,2024-11-05T17:54:10.915440243+07:00
6729f8e0d1bdcae69add90f1,damar,miss you... semestaa mempunyaii banyak cara untuk mengingatkan kenangan saat kita bersama dan sejauh inii lu masii yang terakhir marr. lu ngga kangen balik?? wkwkw,7MYmo0JJJDmu4MZTSAF9y3,On Bended Knee,Boyz II Men,https://i.scdn.co/image/ab67616d0000b2736b3b28022871bae1a5d0f057,2024-11-05T17:52:16.018978629+07:00
6729f77ad1bdcae69add618c,damar,KAMU GANTENG BGT....,0Ryd8975WihbObpp5cPW1t,boyfriend (with Social House),"Ariana Grande, Social House",https://i.scdn.co/image/ab67616d0000b2732ca010dcf3863a07611d8b4f,2024-11-05T17:46:18.3678151+07:00
6729f686d1bdcae69add3fbf,damar,"haii damar apa kabar? aku harap kamu baik baik aja ya dan semoga kamu masih ingat aku ya.iyaa aku,aku orang yang mungkin dulu bisa di bilang sering ganggu waktu kamu,tpi anehnya kmu gak marah sama aku,kmu malah selalu nyempetin waktu untuk aku.klo blh jujur aku kangen banget sama kamu, kangen kamu yang selalu ngabarin aku,  kangenn semua hal tentang kamu, suara kamu,cerita random dari kamu,kangen pap random dari kmu,kangen klo kamu lagi marah,lagi ngambek,dan kangen bawelnya kamu.klo blh jujur aku pengen balik lagi sama kamu tpi kayaknya kamu udh ad yang baru ya.tapi klo di ingat ingat kita dulu lucu ya(mungkin menurut aku aja).bisa dibilang dulu kita sering putus nyambung yaa,tpi gpp klo sama kamu aku bahagia bangettttttttt, meskipun sekarang kita mungkin bener benar gak bisa balik lgi.jujur aku kangen sama kamu yang sering spam dan telfon,kangen kalo kamu udh ngomong sunda tuh kayak canduu gitu.dulu kmu klo sebelum mau pun pulang sekolah selalu ngabarin aku tpi sekarang kamu ngabarin siapa yaa? mungkin cewek baru kamu yang cantik ya.intinya aku kangen,aku selalu nunggu kamu,aku yang selalu berharap kamu tiba tiba nge chat aku,meskipun cuman sekedar nanya kabar.bisa gak sih kita balik sekali lagi,kayaknya gak bisa ya karna kamu udh bahagia dengan yang baru,ya udh itu aja sih.tpi dengan ini aku bisa ngeluarin rasa kangen aku meski gak ke kamu langsung.
dari aku yang kangen dengan kamu",6VggIDYOnf9C8fJVcMpxAu,Kangen,Dewa 19,https://i.scdn.co/image/ab67616d0000b27370ea19fd1f517d40b9c01c0d,2024-11-05T17:42:14.486772273+07:00
6729f526d1bdcae69add1203,damar,"hai!!
Muhammad Damar ezra satriya 
hidup lebih lama ya.. aku mencintaimu",7F4tV8SiUy6itZTdAzdafO,penjaga hati,Nadhif Basalamah,https://i.scdn.co/image/ab67616d0000b2735c60335b52110564cbe57176,2024-11-05T17:36:22.114588981+07:00
6729f131d1bdcae69adc99b0,damar,"Jangan pernah tinggalin akuu yaa sayangg, kita samaa"" teruss sampai kapanpun🤍🌷🎀",557XVqKgnYAxvvyczr2zDg,THANK YOU 4 LOVIN’ ME,Paul Partohap,https://i.scdn.co/image/ab67616d0000b273eec9dbf44607a72f9deab6ef,2024-11-05T17:19:29.034237795+07:00
6729f12ed1bdcae69adc9960,damar,"Mengagumi seseorang yang entah cintanya untuk siapa, sampai bertahun-tahun",5h5CQwgjgQrBUacsqR2zR7,A Thousand Years,James Arthur,https://i.scdn.co/image/ab67616d0000b27341b58c028c3ed6035074bdc1,2024-11-05T17:19:26.833024925+07:00
6729f0d7d1bdcae69adc8f03,damar,"hi, idk kenapa aku bisa ngetik ini skrg wkwkwk, tapi aku cmn mau bilang.. kalo aku selalu pengen minta maaf sama kamu. dan mungkin.. berteman lagi? idk if that will ever happen, but aku bangga sama kamu yg sekarang. you've grown up so much! tittle arsitektur its cocok bgt sama kamuu wkwkwk, keep it up yaa! semangat teruss",22bPsP2jCgbLUvh82U0Z3M,The Way I Loved You (Taylor’s Version),Taylor Swift,https://i.scdn.co/image/ab67616d0000b273a48964b5d9a3d6968ae3e0de,2024-11-05T17:17:59.557851041+07:00
6729ee86d1bdcae69adc472e,damar,"aku kangen kamu maaf aku belum bisa move on dari kamu,maaf kalau kamu risih setidaknya aku udh ungkapin perasaan ini sama kamu,semangat terus untuk keseharian kamu",6VggIDYOnf9C8fJVcMpxAu,Kangen,Dewa 19,https://i.scdn.co/image/ab67616d0000b27370ea19fd1f517d40b9c01c0d,2024-11-05T17:08:06.099321318+07:00
6729ecdfd1bdcae69adc14db,damar,p ini guee hahahahahahaha,754kgU5rWscRTfvlsuEwFp,Kiss Me,Sixpence None The Richer,https://i.scdn.co/image/ab67616d0000b273b182816802535e73e697a1a6,2024-11-05T17:01:03.070855172+07:00
6729ec62d1bdcae69adc05c4,damar,"i miss u sm damar, walaupun hubungan kita ga selama itu, tapi first experience aku ada di kamu, aku selalu kangen kamu setiap waktu mar. aku selalu nolak cowo yang suka sama aku, aku ga berharap kamu bakal balik si, tapi dengan aku ngetik ini bisa mengurangi sedikit rasa kangen aku. ",7MYmo0JJJDmu4MZTSAF9y3,On Bended Knee,Boyz II Men,https://i.scdn.co/image/ab67616d0000b2736b3b28022871bae1a5d0f057,2024-11-05T16:58:58.535656009+07:00
6729ea58d1bdcae69adbc8b3,damar,"bro, I like you",2wAiFWjRupWmnDkQcu91MF,Rumah Ke Rumah,Hindia,https://i.scdn.co/image/ab67616d0000b273d623688488865906052ef96b,2024-11-05T16:50:16.346043027+07:00
6729e809d1bdcae69adb86c1,damar,"haiii semangat yaaaa jangan menyerah apapun itu masalah nya proud of you 
",1zFaLYA10ImwEejge3F5nm,Nina,.Feast,https://i.scdn.co/image/ab67616d0000b27339695d4c16489cdf60bef536,2024-11-05T16:40:25.318791299+07:00
6729e731d1bdcae69adb6f40,damar,"haii, i like u kaa, aku sering ngeliat kka di greja, u was so handsome, aplagi kalo pake baju polo ato kemeja beehhh wkwkwk",1ctbkptXLNIoEVTNAFYV4d,I Like U,NIKI,https://i.scdn.co/image/ab67616d0000b273a18ae038fa4b0519e5e3420e,2024-11-05T16:36:49.008875431+07:00
6729e723d1bdcae69adb6da0,damar,aku sayang banget sama kmu aa jangan tinggalin aku yaaa 🙍🏻‍♀️🤍,34xTFwjPQ1dC6uJmleno7x,Godspeed,Frank Ocean,https://i.scdn.co/image/ab67616d0000b273c5649add07ed3720be9d5526,2024-11-05T16:36:35.064172424+07:00
6729e643d1bdcae69adb5546,damar,i will always lllooove u!!!!!,1RMJOxR6GRPsBHL8qeC2ux,Best Part (feat. H.E.R.),"Daniel Caesar, H.E.R.",https://i.scdn.co/image/ab67616d0000b2733138f891f3075c9c5d944037,2024-11-05T16:32:51.016660876+07:00
6729e4bcd1bdcae69adb2a44,damar,tetep bersama ya,1fDFHXcykq4iw8Gg7s5hG9,About You,The 1975,https://i.scdn.co/image/ab67616d0000b2731f44db452a68e229650a302c,2024-11-05T16:26:20.413042249+07:00
6729e43dd1bdcae69adb1c0d,damar,"hai, semoga kamu liat pesanku ini ya aku seneng bgt bisa kenal kmu, tpi kita cmn sebatas hts eh tpi ga juga deng, aku sebenarnya udah mulai ada rasa sm kmu, maaf ya kalau aku suka sm kmu, aku takut km risi sm aku, semoga di lain waktu kita bisa jadi satu ya, ily ",48BWWtyjFE2le9sIqJitoL,Rahasia Hati,Nidji,https://i.scdn.co/image/ab67616d0000b2733d4e60ab546528ace91c22fb,2024-11-05T16:24:13.510173405+07:00
6729e23fd1bdcae69adae480,damar,1,2wAiFWjRupWmnDkQcu91MF,Rumah Ke Rumah,Hindia,https://i.scdn.co/image/ab67616d0000b273d623688488865906052ef96b,2024-11-05T16:15:43.028796921+07:00
6729e232d1bdcae69adae336,damar,"haiii
gimana hari harimu setelah gk sama aku?kayaknya kamu udh bahagia sama orang baru ya,slamat yaa
aku disini masih berusaha ngelupain kamu,aku mau kamu selalu tapi kyknya kita emg udh gabisa sama sama",09eWF5r8kasfOEp8RFRQLv,Serana,For Revenge,https://i.scdn.co/image/ab67616d0000b27366de8f7224e459d2cc0f9a1f,2024-11-05T16:15:30.767463747+07:00
6729e11ed1bdcae69adac589,damar,olih mbok berharap Bae?,5o6StwqqVfG3vRLx8UP310,Surat Cinta Untuk Starla,Virgoun,https://i.scdn.co/image/ab67616d0000b273cf6af54752ff67e6ce8f86a1,2024-11-05T16:10:54.367718303+07:00
6729e092d1bdcae69adab67f,damar,"kmu lucuu bgt, aku seneng bgt kita udaa pcrn skrg :pppp",22bPsP2jCgbLUvh82U0Z3M,The Way I Loved You (Taylor’s Version),Taylor Swift,https://i.scdn.co/image/ab67616d0000b273a48964b5d9a3d6968ae3e0de,2024-11-05T16:08:34.338709834+07:00
6729df90d1bdcae69ada9bbc,damar,"Kamu cinta pertama ku kak di SMA, dan baru kali ini aku ngerasain 'sakitnya' krna cowo",1zFaLYA10ImwEejge3F5nm,Nina,.Feast,https://i.scdn.co/image/ab67616d0000b27339695d4c16489cdf60bef536,2024-11-05T16:04:16.521085143+07:00
6729d5fbd1bdcae69ad9abb9,damar,lovyuu,7LVHVU3tWfcxj5aiPFEW4Q,Fix You,Coldplay,https://i.scdn.co/image/ab67616d0000b2734e0362c225863f6ae2432651,2024-11-05T15:23:23.366314045+07:00
6729d583d1bdcae69ad9a158,damar,"maafkann akuu yaaa damar:( i really i Miss u but akuu gabisaaa untuk sama kamuu:( di kehidupan selanjutnya smg kita di pertemukan lagi ya 
-aira",4idi4ZCAle2ZTsY1DDwZUM,Itu Aku,Sheila On 7,https://i.scdn.co/image/ab67616d0000b273f0a7efc94687cc049b821529,2024-11-05T15:21:23.316345543+07:00
6729d39fd1bdcae69ad97675,damar,"hai, semangat terus yaa! ",01beCqR9wsVnwzkAJZyTqq,I Love You but I'm Letting Go,Pamungkas,https://i.scdn.co/image/ab67616d0000b27304d4b84c6eb6b24d61bbd963,2024-11-05T15:13:19.856401685+07:00
6729d388d1bdcae69ad97448,damar,trimakasih sudah hadir di hidup ini! i love you ᰔᰔ,5H4MSA6eIr6x1iBTn1vpMG,Semenjak Ada Dirimu,"Yovie Widianto, Hivi!",https://i.scdn.co/image/ab67616d0000b2735ca80c8a6caedb9143ff4f32,2024-11-05T15:12:56.167901096+07:00
6729d1a3d1bdcae69ad94a89,damar,"aku kangen kamu, kangen banget tapi aku ngga mau ganggu kamu, kamu bneran uda lupain aku ya?? aku masih disini dengan perasaan yang sama, aku kangen kita chatan sampai malam, kangen semua tentang kamu, kamu jaga diri baik² ya",0IktbUcnAGrvD03AWnz3Q8,Lucky,"Jason Mraz, Colbie Caillat",https://i.scdn.co/image/ab67616d0000b273125b1a330b6f6100ab19dbed,2024-11-05T15:04:51.011122403+07:00
6729d163d1bdcae69ad9450c,damar,"hii damar, i love u sm. aku kangen senyuman kamu wkwkw",4zRZAmBQP8vhNPf9i9opXt,8 Letters,Why Don't We,https://i.scdn.co/image/ab67616d0000b273b503cdb444b28826c4ca9217,2024-11-05T15:03:47.96389014+07:00
6729d151d1bdcae69ad9438f,damar,"di perjalanan yang panjang ini,jangan jadi milik siapapun dulu ya?
-3726 mdpl",1fDFHXcykq4iw8Gg7s5hG9,About You,The 1975,https://i.scdn.co/image/ab67616d0000b2731f44db452a68e229650a302c,2024-11-05T15:03:29.438942385+07:00
6729d0f6d1bdcae69ad93bb6,damar,"haii kakk, tw ga sii damar itu sempurna bgt dari segi manapun, ga capee cakepp terus ya? i love u more n moree kakk, kl dunia jahat km cerita ya?, rivaa selalu nungguinn tau",48BWWtyjFE2le9sIqJitoL,Rahasia Hati,Nidji,https://i.scdn.co/image/ab67616d0000b2733d4e60ab546528ace91c22fb,2024-11-05T15:01:58.383620637+07:00
6729cfc0d1bdcae69ad92107,damar,please come back to me -alee,4aT6vP9y2eDjxmRGm5ZqSC,Location Unknown ◐ (feat. BEKA) - Brooklyn Session,"HONNE, BEKA",https://i.scdn.co/image/ab67616d0000b273281e671298095c70e7a4d3af,2024-11-05T14:56:48.596667045+07:00
6729cea6d1bdcae69ad90a3d,damar,"untuk kamu si pemilik senyum manis diperjalanan yang jauh ini jangan jadi milik siapapun yaa 

-sykra",48BWWtyjFE2le9sIqJitoL,Rahasia Hati,Nidji,https://i.scdn.co/image/ab67616d0000b2733d4e60ab546528ace91c22fb,2024-11-05T14:52:06.992235733+07:00
6729cd90d1bdcae69ad8f359,damar,"aku kangen kamu, kangen banget but aku ngga mau ganggu kamu, kamu bneran uda lupain aku ya?? aku masih disini dengan perasaan yang sama, aku kangen kita chatan sampai malam, kangen semua tentang kamu, kamu jaga diri baik² ya",44A0o4jA8F2ZF03Zacwlwx,Je te laisserai des mots,Patrick Watson,https://i.scdn.co/image/ab67616d0000b2738ea92a85c492af8a38750549,2024-11-05T14:47:28.900530489+07:00
6729cce8d1bdcae69ad8e5a8,damar,"tolong jangan slowresp deh lo, untung ganteng",2UgCs0i0rNHUH2jKE5NZHE,Sempurna,Andra & The Backbone,https://i.scdn.co/image/ab67616d0000b2730df7dec70511dd4f2e69dc34,2024-11-05T14:44:40.662586935+07:00
6729cc0bd1bdcae69ad8d385,damar,"halo damar! kalo kamu liat ini (walau kayanya engga ya) semoga kamu baik-baik aja di Magelang ya! terimakasih ya udah mau percaya ke aku, imysm, i love youu, semoga kita bisa bertemu lagi!! -🦖",7IL8PSVwLOJxqYne6azxQv,Pretty Boy,The Neighbourhood,https://i.scdn.co/image/ab67616d0000b2731a721f3757e5b67f87e1acd3,2024-11-05T14:40:59.860203174+07:00
6729cbf9d1bdcae69ad8d207,damar,"haii? sebelumnya makasii karnaa suda pernah ada di dalam hidupku, sekarang masa kita udah selesai aku harap kamu bisa jaga diri kamu dengan baik yaa, i loved youu",7F4tV8SiUy6itZTdAzdafO,penjaga hati,Nadhif Basalamah,https://i.scdn.co/image/ab67616d0000b2735c60335b52110564cbe57176,2024-11-05T14:40:41.100099222+07:00
6729cbf5d1bdcae69ad8d1bf,damar,"haloo kakk, kangenn bgt tw sm damarr smogaa balik yaa klau km bacaa akuu ini rivaa😔",48BWWtyjFE2le9sIqJitoL,Rahasia Hati,Nidji,https://i.scdn.co/image/ab67616d0000b2733d4e60ab546528ace91c22fb,2024-11-05T14:40:37.080769269+07:00
6729cb05d1bdcae69ad8be7a,damar,"halo damar udh lama kita ga ngobrol bareng lagi ya? udh ga chtn lagi ya? jujur aku kangen kamuu damar, how are u? udh lama aku gapernah denger kabar kamu lagi semoga baik' saja yaa... I want to meet u damar') nanti sabtu aku usahain ke wrdy yaa setelah aku lomba insyaallah aku kesana... I pray that it goes smoothly yapp!! #eys",13sOb9V6Y3uCnRxY9HIZqP,if u could see me cryin' in my room,"Arash Buana, raissa anggiani",https://i.scdn.co/image/ab67616d0000b2735f95e95fefcbafd47ffd6130,2024-11-05T14:36:37.615234665+07:00
6729ca95d1bdcae69ad8b5ae,damar,klo ada yg lebih indah dari intro lagu sempurna mungkin itu kak damar,2UgCs0i0rNHUH2jKE5NZHE,Sempurna,Andra & The Backbone,https://i.scdn.co/image/ab67616d0000b2730df7dec70511dd4f2e69dc34,2024-11-05T14:34:45.385761819+07:00
6729c8f4d1bdcae69ad894c2,damar,"hai damar,makasi ya Uda jadi rumah aku yg terbaik,udah nemenin aku selama ini,udah bikin hidup aku bewarna tapi sekarang pudar ☹️,makasi ya inget larangan dari aku sehat sehat selalu ya cintaku semestaku.semoga posisi aku jangan tergantikan dulu sama cewe lain heheh",6VggIDYOnf9C8fJVcMpxAu,Kangen,Dewa 19,https://i.scdn.co/image/ab67616d0000b27370ea19fd1f517d40b9c01c0d,2024-11-05T14:27:48.892622726+07:00
6729c8e8d1bdcae69ad893b2,damar,"kangen km, bole ga si kita mulai dari awal?",0XZW4ZKXOwo9kCyDpXGNc7,Oceans & Engines,NIKI,https://i.scdn.co/image/ab67616d0000b273d3997a4c208ac08dafff374f,2024-11-05T14:27:36.692000636+07:00
6729c8dcd1bdcae69ad892ad,damar,"rindu sekaliiii, tapi kayaknya harus letting go ya?????? My dearest, damar. Just know that i have a thousand letter that i never send, i love to read it. Its remind me about how i love you
Meski sekarang terasa seperti orang asing
Mar, semoga lain kali, barang kali, bisa bersama. Youre precious.",0XZW4ZKXOwo9kCyDpXGNc7,Oceans & Engines,NIKI,https://i.scdn.co/image/ab67616d0000b273d3997a4c208ac08dafff374f,2024-11-05T14:27:24.350102163+07:00
6729c85fd1bdcae69ad88912,damar,"heyy aa damar, gf bona. 
gimanaa pkl di babeh nyaa, pengin ngobroll tapi kita gapernah ngobrol🥺🥺🥺🥺🥺
semangat terus ya! tetep jadi cowo lurus ❤️❤️",1fDFHXcykq4iw8Gg7s5hG9,About You,The 1975,https://i.scdn.co/image/ab67616d0000b2731f44db452a68e229650a302c,2024-11-05T14:25:19.654035285+07:00
6729c511d1bdcae69ad849d4,damar,"haloo marr klo udh lulus jngn lupain ak yaa,wlaupun gk prnh komunikasi sma kmuu ttp jaga ksahatan yaa
-adkel",6RiiSy9GzSwiyDEJDiMuKe,Something About You,"Eyedress, Dent May",https://i.scdn.co/image/ab67616d0000b27316f48ac1e989d7acc028e9cf,2024-11-05T14:11:13.693790658+07:00
6729c2ffd1bdcae69ad82195,damar,kane,3e1rs346dsDDwpqTRGlRZR,Somebody's Pleasure,Aziz Hedra,https://i.scdn.co/image/ab67616d0000b2730104b1f71c7bd8e6e5ea1fd2,2024-11-05T14:02:23.18880612+07:00
6729c28dd1bdcae69ad81907,damar,"hi damar, 13 heree. i miss u so bad:(",3xpMytpniCnjXCgy7TcFDw,Bawalah Cintaku,Afgan,https://i.scdn.co/image/ab67616d0000b273daa3a5d2478cc796925f7c90,2024-11-05T14:00:29.051644521+07:00
6729c0e6d1bdcae69ad7f958,damar,"Hai mar, ini aku. Dari banyaknya pesan buat damar disini aku harap kamu bisa nemuin dari aku. Aku sayang banget sama kamu, aku berharap masih bisa ketemu lagi dan ngelakuin banyak hal kaya dulu lagi. Jakarta indah ya mar malem malem, kangennn. Semoga kamu sehat selalu dan dikelilingin orang yang sayang sama kamu aku harap salah satunya itu aku. :)",2RHm5IDIZ8fYRGzBIo7exV,Tampar,Juicy Luicy,https://i.scdn.co/image/ab67616d0000b273895ef71f3b84221075ac06f5,2024-11-05T13:53:26.808931701+07:00
6729c043d1bdcae69ad7ecfb,damar,"tetepp jadii damarrr yangg aku kenall yaaaa,jangann asingg",5JESuE80fvausWHjcT9QVh,Aku Milikmu,Dewa 19,https://i.scdn.co/image/ab67616d0000b273bfc7fa507f4bc822cabe7bde,2024-11-05T13:50:43.731950931+07:00
6729bf95d1bdcae69ad7e017,damar,"i like you, tapi kayanya bukan lo orangnya ",0uTJacQiXYN5EZqBCoSCOz,Bukan Orangnya,Juicy Luicy,https://i.scdn.co/image/ab67616d0000b273fadca79809c06f6afe7de0d9,2024-11-05T13:47:49.052594785+07:00
6729bf12d1bdcae69ad7d6b6,damar,LOOVEE U MOREEE MENG! SAMAA AK TRS YAAA!💗,0ROj512WvJ1eqeELd7MEdJ,Sampai Jadi Debu (Menampilkan Gardika Gigih),Banda Neira,https://i.scdn.co/image/ab67616d0000b273c1528165fd2e76da5331b48c,2024-11-05T13:45:38.652566868+07:00
6729be20d1bdcae69ad7c42a,damar,dam disini gue selalu ngagumin lu gue tetep suka sama lu dan gue gabisa buat berhenti suka sama lu,1fDFHXcykq4iw8Gg7s5hG9,About You,The 1975,https://i.scdn.co/image/ab67616d0000b2731f44db452a68e229650a302c,2024-11-05T13:41:36.148970947+07:00
6729bca2d1bdcae69ad7a81b,damar,"semangat yaa Soeratin nyaa, walaupun kita udah gada hubungan apa pun tp kmu tetep aku anggap pacar ko haha.. mis u damar love u semangat latian bola yaa!!! sehat² terus yaa!!!",3vkCueOmm7xQDoJ17W1Pm3,My Love Mine All Mine,Mitski,https://i.scdn.co/image/ab67616d0000b27334f21d3047d85440dfa37f10,2024-11-05T13:35:14.707385491+07:00
6729bba8d1bdcae69ad7964a,damar,DAMARR COWO GUE WOOII 😛🫵🏻🫵🏻,3vkCueOmm7xQDoJ17W1Pm3,My Love Mine All Mine,Mitski,https://i.scdn.co/image/ab67616d0000b27334f21d3047d85440dfa37f10,2024-11-05T13:31:04.544080382+07:00
6729ba2cd1bdcae69ad77b9e,damar,"Ganteng banget sih
Btw kita sekelas lohh
I have crush on you♥️♥️♥️🫰🏻🫰🏻🫰🏻🫰🏻",0rgEL2cD2T5MDzSDJTQNlw,Jatuh Hati,Raisa,https://i.scdn.co/image/ab67616d0000b273f018e2376d8060e0ba1112ab,2024-11-05T13:24:44.967971959+07:00
