_id,recipient,message,song_id,song_name,song_artist,song_image,created_at
6731d39a07cffbc4dc780401,damar,"fuck you, kenapa dulu kita ga bisa bersama ya, padahal aku sudah kenal mama mu, mungkin karena aku bukan dinda atau nayla ya, semoga kita ga bakal bertemu lagi ya setelah lulus nanti ",0WbMK4wrZ1wFSty9F7FCgu,"Good Luck, Babe!",Chappell Roan,https://i.scdn.co/image/ab67616d0000b27391b4bc7c88d91a42e0f3a8b7,2024-11-11T16:51:22.066718754+07:00
6731d0f207cffbc4dc77f5b7,damar,"I love you marrr, btw ak suka kamu tw 




-from pinut",2UgCs0i0rNHUH2jKE5NZHE,Sempurna,Andra & The Backbone,https://i.scdn.co/image/ab67616d0000b2730df7dec70511dd4f2e69dc34,2024-11-11T16:40:02.76210245+07:00
6731cfceaa62252eea4c8dfc,damar,"i hate play mobile legends again bcs of u, i hate jun n july, i hate the song ""rahasia hati&sempurna"", i hate my friend ask about u, i hate same ppl as u, i hate everything that reminds me of you, i hate meet u",09eWF5r8kasfOEp8RFRQLv,Serana,For Revenge,https://i.scdn.co/image/ab67616d0000b27366de8f7224e459d2cc0f9a1f,2024-11-11T16:35:10.820118659+07:00
6731c879e5eeda5ba3000fc3,damar,aku gabisa ngerubah sifat kamu untuk bisa jadi apa yang aku mau... tapi aku tidak pernah ngerasa kecewa sama sekali sama sifat mu,6fMS9J2yAv4I6ss9sQ230f,Kini Mereka Tahu,Bernadya,https://i.scdn.co/image/ab67616d0000b2736de51cd90bfb48588c092a23,2024-11-11T16:03:53.788119942+07:00
6731c7fde5eeda5ba3000d37,damar,"aku kangen kamu, aku kangen dipanggil sayang :(",0e2wfbDK7ppotqyUWD7qs8,La La Lost You - Acoustic Version,"NIKI, 88rising",https://i.scdn.co/image/ab67616d0000b2738b0e2044b4b20f24908f7122,2024-11-11T16:01:49.269288356+07:00
6731c25be5eeda5ba3fff17d,damar,"Aku suka kamu dri pas kita kls 4 maafin ya udh ngecewain mama km..klo km baca ini semoga kmu nerima confess aku <3
-N 6D",161DnLWsx1i3u1JT05lzqU,Talking to the Moon,Bruno Mars,https://i.scdn.co/image/ab67616d0000b273f6b55ca93bd33211227b502b,2024-11-11T15:37:47.272433968+07:00
6731c1b0e5eeda5ba3ffee49,damar,"haii, kamu apa kabar?? maaf ya aku gabisa lupain kamu, jujur aku masih mau chatan sama kamu tapi aku udah hapus chat kita jd ngga bisa nemuin akun kamu..",5enxwA8aAbwZbf5qCHORXi,All Too Well (10 Minute Version) (Taylor's Version) (From The Vault),Taylor Swift,https://i.scdn.co/image/ab67616d0000b273318443aab3531a0558e79a4d,2024-11-11T15:34:56.430449431+07:00
6731ba2ce5eeda5ba3ffccb3,damar,"dam, aku kangen kamu..",6VggIDYOnf9C8fJVcMpxAu,Kangen,Dewa 19,https://i.scdn.co/image/ab67616d0000b27370ea19fd1f517d40b9c01c0d,2024-11-11T15:02:52.462212606+07:00
6731b8e8e5eeda5ba3ffc6ed,damar,"haaloooo tengill akuu,eummm akuuu senengg bangett punyaa hubungann samaa kamuuu sayangggg akuu pengenn kitaaa selamanyaa kayaa giniii yaaa hihi ohhyaaa kamuu sekarangg jarangg kasihh kabarrr ihhhh tapii gapapaaaaaa kamuu pastii lagi sibukk yaaa

akuuu sayang bangett sama kamuuu tengillkuuuu",7F4tV8SiUy6itZTdAzdafO,penjaga hati,Nadhif Basalamah,https://i.scdn.co/image/ab67616d0000b2735c60335b52110564cbe57176,2024-11-11T14:57:28.412400477+07:00
6731b398e5eeda5ba3ffaf88,damar,"

Damar Ardiyanto 
Kapan kita bisa ketemu lagi?
Aku kangen pas kita bisa ketemu dimana pun itu 
Pokoknya aku kangennn bangettt sama kamuu
Yaa tapi aku gak bisa apa apa sih selain nunggu kamu di sini
Sehat sehat ya kamu di sana",6VggIDYOnf9C8fJVcMpxAu,Kangen,Dewa 19,https://i.scdn.co/image/ab67616d0000b27370ea19fd1f517d40b9c01c0d,2024-11-11T14:34:48.125186128+07:00
6731b177e5eeda5ba3ffa641,damar,i love u,3e1rs346dsDDwpqTRGlRZR,Somebody's Pleasure,Aziz Hedra,https://i.scdn.co/image/ab67616d0000b2730104b1f71c7bd8e6e5ea1fd2,2024-11-11T14:25:43.758629443+07:00
6731b118e5eeda5ba3ffa48a,damar,aku nyesel pernah punya hubungan dengan kamu ,5KYUrBgdbIcqwaGSIgfXPl,Apa Mungkin,Bernadya,https://i.scdn.co/image/ab67616d0000b2738869d13091935994879f2a47,2024-11-11T14:24:08.986240537+07:00
6731a843e5eeda5ba3ff7fa2,damar,"hello kakk! i wanted to ask you why did you ignore me that day..im sorry if i was annoying and made you uncomfortable i really am..if you actually have a girl now im sorry again, but my feelings of almost 3 years cant just dissapear..i watched dbl just to see you and it kinda hurted when you acted like that. Maybe you did see me cry that day and didng care...ijust want to ask how u were feeling that day? just you know i really fell for you..deep..everyone says i deserve better but i dont want better..i want you. I know its stupid but i really do love you but if you really chooses another girl..i hope she makes you happy! good luck kak",4Y9Ge3i5r0vgFAZq653Yx3,Second Best,Laufey,https://i.scdn.co/image/ab67616d0000b27374c732f8aa0e0ccbb3d17d96,2024-11-11T13:46:27.778917044+07:00
67319f49e5eeda5ba3ff599c,damar,"wajah mu semanis senja 
tapi cinta mu masih ada di orang lama ",09eWF5r8kasfOEp8RFRQLv,Serana,For Revenge,https://i.scdn.co/image/ab67616d0000b27366de8f7224e459d2cc0f9a1f,2024-11-11T13:08:09.166323435+07:00
67319700e5eeda5ba3ff36dc,damar,"gatauu kamu bakal liat pesan ini apaa enggaa, intinya miss u sm mar!! aku kangen kamu banget, sorry yaa",6mXdCcFnPKQznj4CmMRmHC,Mean It,"Lauv, LANY",https://i.scdn.co/image/ab67616d0000b2732c0e1e9e1fd1e7b132da1606,2024-11-11T12:32:48.7396829+07:00
67318590e5eeda5ba3fef077,damar,"Hai, gantengku Damar
Aku udah sesayang ini sama kamuu
Boleh gaaa jangan pergi yaaa
Aku tau kamu cape ngadepin akuu
Tapi aku yakin kamu bisa sabar.
Jangan berhenti buat sayang sama akuu yaaa.
Sehat sehat gantengkuuu, I love u moree",7LVHVU3tWfcxj5aiPFEW4Q,Fix You,Coldplay,https://i.scdn.co/image/ab67616d0000b2734e0362c225863f6ae2432651,2024-11-11T11:18:24.366998026+07:00
67318550e5eeda5ba3feef57,damar,"Bahagia terus yab 
-heeeeeuuu",3iBgrkexCzVuPy4O9vx7Mf,Glue Song,beabadoobee,https://i.scdn.co/image/ab67616d0000b273e3862aeefcb2f0860ef017e4,2024-11-11T11:17:20.223467661+07:00
67318211e5eeda5ba3fee229,damar,cuma mau bilang gue kangen lo dam,6VggIDYOnf9C8fJVcMpxAu,Kangen,Dewa 19,https://i.scdn.co/image/ab67616d0000b27370ea19fd1f517d40b9c01c0d,2024-11-11T11:03:29.096215593+07:00
67317da8e5eeda5ba3fed102,damar,december ketemu aku ya!,1Ztka7fCyxUv46FW1mZH9T,December (again) [feat. Mark Hoppus],Neck Deep,https://i.scdn.co/image/ab67616d0000b273e70bc643bf8fa257f341a4ed,2024-11-11T10:44:40.841845416+07:00
67317d11e5eeda5ba3fecebd,damar,"mau bilang aja kalo yg ngirim ini suka sm si penerima, si pengirim ini confess tp ga berani buat ngomong lgsng jd lewat sendthesong aja ke si penerima, eh iya smga langgeng yaa sm yg skrg☺",0W5o1Kxw1VlohSajPqeBMF,Autumn,NIKI,https://i.scdn.co/image/ab67616d0000b273d3997a4c208ac08dafff374f,2024-11-11T10:42:09.5630623+07:00
6731708fe5eeda5ba3fea001,damar,aku diam diam menyukainya ,2plbrEY59IikOBgBGLjaoe,Die With A Smile,"Lady Gaga, Bruno Mars",https://i.scdn.co/image/ab67616d0000b27382ea2e9e1858aa012c57cd45,2024-11-11T09:48:47.114305139+07:00
6731684be5eeda5ba3fe82ec,damar,"jangan seperti itu lagi ya, kalau kamu sudah punya pasangan, tolong jaga perasaanya, seperti di yang menjaga perasaan mu. dekat dengan lawan jenis seperlu nya saja ya, jangan terlalu dekat, aku percaya pada mu, tapi tidak dengan orang lain yang menyukai mu

seterusnya tolong hidup dengan baik, jangan merokok, aku ngga suka. jaga diri kamu. jangan cuek cuek ya nanti sama pasangan baru mu, jangan di buat feeling lonely kayak aku, hmm jangan dekat juga dengan teman perempuan ku, aku..sakit.

buat pasangan mu merasakan perhatian mu, buang jauh jauh sifat buruk mu, jangan menempatkan dia dalam posisi yang pernah aku rasakan. 

jangan putus asa, semangat!!",3xpMytpniCnjXCgy7TcFDw,Bawalah Cintaku,Afgan,https://i.scdn.co/image/ab67616d0000b273daa3a5d2478cc796925f7c90,2024-11-11T09:13:31.325430043+07:00
67314ff3e5eeda5ba3fe3bd9,damar,MANIS BANGET SENYUMANMU ,6mXdCcFnPKQznj4CmMRmHC,Mean It,"Lauv, LANY",https://i.scdn.co/image/ab67616d0000b2732c0e1e9e1fd1e7b132da1606,2024-11-11T07:29:39.691545824+07:00
67314855e5eeda5ba3fe2c1b,damar,Bjir,754kgU5rWscRTfvlsuEwFp,Kiss Me,Sixpence None The Richer,https://i.scdn.co/image/ab67616d0000b273b182816802535e73e697a1a6,2024-11-11T06:57:09.295406663+07:00
67313e23e5eeda5ba3fe1908,damar,maaf ga bisa ngertiin,5TReP8XK4aTOe2m44ZjQqz,Tujuh Belas,Tulus,https://i.scdn.co/image/ab67616d0000b273d34a0632f6861e8875d6899b,2024-11-11T06:13:39.617176175+07:00
67313ddee5eeda5ba3fe1884,damar,"Haloo sayangg kuu cintaa kuu semestaaaa kuu,kamuu jangan ovt teruss yaa,kamuu ituu udaa jadi pemenangnya akan hati akuu,gaakan ada yang lain lagii, pokoknya aku sayang bgtt sama kamuuu, tetep temani aku yaa,akuu gabisa kalo gaada kamu sayangg,iii loveee youu moree thann🤍🤍🤍🤍",1fDFHXcykq4iw8Gg7s5hG9,About You,The 1975,https://i.scdn.co/image/ab67616d0000b2731f44db452a68e229650a302c,2024-11-11T06:12:30.731643424+07:00
67310cfae5eeda5ba3fdd3ee,damar,"aneh ngga sih aku bisa suka kamu dari 2014 sampai sekarang,meskipun sempet deket sama yg lain tapi km tetep pemenangnya.semustahil itukah perasaanku terbalas :) i miss you & i love u 4ever",1fDFHXcykq4iw8Gg7s5hG9,About You,The 1975,https://i.scdn.co/image/ab67616d0000b2731f44db452a68e229650a302c,2024-11-11T02:43:54.876243437+07:00
6730e99de5eeda5ba3fd780c,damar,"kngn di panggil bocil ndut sama kmu:(
maaf ya aku terlalu paksa kmu buat sama aku terus, padahal tujuan kmu bukan aku, aku di sini selalu doain kmu yg terbaik, kamu jangan nangis malam' yaa, kurangin mam mie nya, jangan banyak pikiran nanti dadanya sakit, aku ga suka klo kmu bnyk pikiran, sayang kmu banyak banyak🙁🤍",13sOb9V6Y3uCnRxY9HIZqP,if u could see me cryin' in my room,"Arash Buana, raissa anggiani",https://i.scdn.co/image/ab67616d0000b2735f95e95fefcbafd47ffd6130,2024-11-11T00:13:01.724427375+07:00
6730e331e5eeda5ba3fd58dd,damar,lest goooo,6GCW5Muk3u0cM5QTkS4C9a,The One That Got Away,Katy Perry,https://i.scdn.co/image/ab67616d0000b27343219fb4e2c45a0b7df6ef87,2024-11-10T23:45:37.952724973+07:00
6730d18ce5eeda5ba3fce3e8,damar,"kita sama sama suka kah, mar?",0Ryd8975WihbObpp5cPW1t,boyfriend (with Social House),"Ariana Grande, Social House",https://i.scdn.co/image/ab67616d0000b2732ca010dcf3863a07611d8b4f,2024-11-10T22:30:20.759831141+07:00
6730d068e5eeda5ba3fcdad1,damar,hai aku tau kita ga deket deket amat tapi plis aku denger kabar kamuu Deket sama orang lain itu sakit kamu itu first love aku walaupun komunikasi kita jelek tapii aku sakitt wehh :(,0W0iAC1VGlB82PI6elxFYf,Guilty as Sin?,Taylor Swift,https://i.scdn.co/image/ab67616d0000b2735076e4160d018e378f488c33,2024-11-10T22:25:28.418845846+07:00
6730c7bae5eeda5ba3fc90cc,damar,"Damar melody angkasa,peka dikit dong ajg gw tu suka sama loo But since yesterday you've been avoiding me,and skrg lo uda punya cewek ajgg kenapa si kenapa lo ga pernah liat gw si angkasaa!!!!",2x3vwXWuecPrRqgEUuSUJA,Semua Aku Dirayakan,Nadin Amizah,https://i.scdn.co/image/ab67616d0000b273e1ea9379951ad47d8fef07d6,2024-11-10T21:48:26.097573356+07:00
6730c2c4e5eeda5ba3fc63cd,damar,boleh ga sih aku suka kamu?,4CFSn8D1ZGNTzQiVEKvJV8,Only,DAY6,https://i.scdn.co/image/ab67616d0000b273669e6dd18faa5b4d9a64b29e,2024-11-10T21:27:16.820555295+07:00
6730c14ce5eeda5ba3fc5691,damar,"dam aku minta maaf udah pernah buat kamu kecewa, aku mau usaha buat perbaiki itu maaf jika usaha aku belum terlihat",630DpnzdfjdVqv2yLfPbAX,Bertaut,Nadin Amizah,https://i.scdn.co/image/ab67616d0000b2736d57a5c60decaa8fb39d5afb,2024-11-10T21:21:00.581710467+07:00
6730b9c2e5eeda5ba3fc0e3d,damar,"i miss u sm, i miss u, i miss u so.. much.. sebenarnya udah gak kangen, tapi gak tau kenapa malam ini kangen kamu",6VggIDYOnf9C8fJVcMpxAu,Kangen,Dewa 19,https://i.scdn.co/image/ab67616d0000b27370ea19fd1f517d40b9c01c0d,2024-11-10T20:48:50.550483437+07:00
6730b812e5eeda5ba3fbfd3f,damar,this songs reminds me of you ,48BWWtyjFE2le9sIqJitoL,Rahasia Hati,Nidji,https://i.scdn.co/image/ab67616d0000b2733d4e60ab546528ace91c22fb,2024-11-10T20:41:38.000966146+07:00
6730b5fce5eeda5ba3fbe7bb,damar,"every single time i spent with u, is my best kind of time in my life. damar A, thank u for living in this world. i'm happy to know u.

-ur classmaTe",5H4MSA6eIr6x1iBTn1vpMG,Semenjak Ada Dirimu,"Yovie Widianto, Hivi!",https://i.scdn.co/image/ab67616d0000b2735ca80c8a6caedb9143ff4f32,2024-11-10T20:32:44.463870732+07:00
6730aea1e5eeda5ba3fb9e23,damar,sorry kalo aku ga pernah ngertiin kamu,51rfRCiUSvxXlCSCfIztBy,"I Love You, I'm Sorry",Gracie Abrams,https://i.scdn.co/image/ab67616d0000b2736e2101520787791370f4a96b,2024-11-10T20:01:21.874127847+07:00
6730ad8fe5eeda5ba3fb9305,damar,"Aku tau kamu sedang trauma, aku tau kalo tulus kamu salah orang terus, aku tau kok tapi jangan sampai ya kamu nyakiti diri kmu sendiri, jaga diri kamu baik' ya aku akan terus nemenin kamu sampai sembuh🥹☺️💖",0J7eKnQIrajXmR5VePSvTx,Aku Disini Untukmu,"MALIQ & D'Essentials, Dewa 19",https://i.scdn.co/image/ab67616d0000b27366254746bcef77df47b04006,2024-11-10T19:56:47.236005998+07:00
6730a47de5eeda5ba3fb3904,damar,"aloo damaar…. iih lo lucu bgt deeeh, sukakk kan jadinyaa. i have crush on you tauuu, tapii,,,, lo blm selesai sm yg laluu,, sedi bgt sbnry tapiiii yaudalayaaa. lo sih mixed signal bgtt. kesel deh. au ah",2ezMnGfGww3WSOJp7TwI1N,blue,yung kai,https://i.scdn.co/image/ab67616d0000b2732c78500833c22279f8bef841,2024-11-10T19:18:05.512073306+07:00
6730a04fe5eeda5ba3fb11a0,damar,patah hati,5hkQFKFRrr5gKdbbxsg6Lj,Jakarta Hari Ini,"For Revenge, Stereo Wall",https://i.scdn.co/image/ab67616d0000b2735d91faeeeb5c97614c28faf0,2024-11-10T19:00:15.329788383+07:00
67309fade5eeda5ba3fb0b77,damar,"Hey, happy (late) birthday ya... tbh i still want to be your friend apalagi sekarang kita ketemu lagi.. so sorry for what i did in the past, i hope you're happy now ",0j1Ia2lQWrcXrQZI4AdJlk,IDK You Yet,Alexander 23,https://i.scdn.co/image/ab67616d0000b273fe03064db12346c962cd0c56,2024-11-10T18:57:33.428020602+07:00
67309de1e5eeda5ba3fafa0a,damar,"Damar Prayoga...
Gua suka lu jangan mikir gua suka sama cowok lain,gua masih gamonin elu sumpah 🥲",5o6StwqqVfG3vRLx8UP310,Surat Cinta Untuk Starla,Virgoun,https://i.scdn.co/image/ab67616d0000b273cf6af54752ff67e6ce8f86a1,2024-11-10T18:49:53.293480173+07:00
6730915ee5eeda5ba3fa88d6,damar,yes,48BWWtyjFE2le9sIqJitoL,Rahasia Hati,Nidji,https://i.scdn.co/image/ab67616d0000b2733d4e60ab546528ace91c22fb,2024-11-10T17:56:30.666027028+07:00
67308c31e5eeda5ba3fa5cac,damar,damarrr kayak nya aku suka deh ma kamu saat cuma kita berdua depan lab biologi kau nungguin temenmu aku nungguin adek ku. i like u ,4SqWKzw0CbA05TGszDgMlc,I Love You So,The Walters,https://i.scdn.co/image/ab67616d0000b2739214ff0109a0e062f8a6cf0f,2024-11-10T17:34:25.859143123+07:00
67308798e5eeda5ba3fa37dd,damar,"Hi damar! ak temen sekelas khe hehe..sebenernya ak sk sm khe udh dr lama, gatau yaaa, aku nyoba uncrush khe krn kh bes friendly menurutku..smua cwe kh ladenin even yg beda sekolah. aku uncrush kh dengan cara nyari aib khe dan mencari orng baru, TAPI SUSAH ANJIR MAR..gatau ya km drmnpun ganteng hehe..photogenic juga, ak jujur iri sm dhina partner jurnalistik km..TPI KAK DHINA BAIK BNGETT, cantik juga..km cocok sm kak dhina hehe, aku iri sm km mar, khe ganteng pintar, di sukain byk cewe, multitalent, keluarga khe baik juga. apa yang tuhan ambil dari khe mar? khe bes perfect damar. aku disini lagi merawat diri biar worth utk pacran sm khe, tp sifat khe y gt kadang bes brengsek. sifat brengsek khe tu dah kadang buat aku mikir khe jd org yg paling buruk SEDUNIA. Persetan sifat khe, aku masih tetep suka sama khe kok, walaupun ak bilang suka sm sp” gt, tapi hati ku buat khe aja, semoga khe pacarannya sm aku yaa!",166kBNN7MrupzFzSDm75MY,How To Say I Love You,New Hope Club,https://i.scdn.co/image/ab67616d0000b273b543536546758ed839910f13,2024-11-10T17:14:48.500130308+07:00
673084d3e5eeda5ba3fa221f,damar,"haii kamu apa kabar?? bulan oktober kemarin tiba’ banget kamu ga chat aku lagii, even buat pamitan sebelum kamu bener’ off:)
aku ada salahh??
I'm really waiting for u 
Please call me whenever u can

miss u so much ",4s5B70nF4StXSaCwP6C0AU,Take A Chance With Me,NIKI,https://i.scdn.co/image/ab67616d0000b27389aa3d00d339b8948374782b,2024-11-10T17:02:59.62421942+07:00
6730830be5eeda5ba3fa1445,damar,"Bingung gw ko ada orang se kontol lu si anjing
Kenapa gw kenal Ama lu kontol",3L5gk3sesbQIvymuKbImuM,Ratna Anjink,"Lil Salmonela, Lil Kujang",https://i.scdn.co/image/ab67616d0000b2739edf705ff97263e916f8dfbb,2024-11-10T16:55:23.69137153+07:00
67308246e5eeda5ba3fa0e4b,damar,tumbuh lebih baik,4deAN7JXhdHHifxOp0TTjU,Do You Like Me?,Daniel Caesar,https://i.scdn.co/image/ab67616d0000b2737c68face1dc58127f3a7b1cc,2024-11-10T16:52:06.379525558+07:00
67307e78e5eeda5ba3f9f1d1,damar,"aku
",2UgCs0i0rNHUH2jKE5NZHE,Sempurna,Andra & The Backbone,https://i.scdn.co/image/ab67616d0000b2730df7dec70511dd4f2e69dc34,2024-11-10T16:35:52.675249209+07:00
67307c50e5eeda5ba3f9e1d1,damar,love u mar,34xTFwjPQ1dC6uJmleno7x,Godspeed,Frank Ocean,https://i.scdn.co/image/ab67616d0000b273c5649add07ed3720be9d5526,2024-11-10T16:26:40.129334305+07:00
67307bc4e5eeda5ba3f9de0e,damar,"kenapa kita ga chattan lagi, chattan sama aku ga asikk yah??  ayo chat aku lagii pasti aku bales koo.   klo aku gengsi kmu juga gengsi, yaudah lost contact...  -S",2IVsRhKrx8hlQBOWy4qebo,Mr. Loverman,Ricky Montgomery,https://i.scdn.co/image/ab67616d0000b27367ee332af483acd134fd6fd0,2024-11-10T16:24:20.378807609+07:00
67307a38e5eeda5ba3f9d308,damar,"aku gataau nama lengkapmu pls, tp intinya aku kgn kmu, aku gapernah tau kabarmu smenjak kamu pindah sekolaa waktu SD dulu:((",1fDFHXcykq4iw8Gg7s5hG9,About You,The 1975,https://i.scdn.co/image/ab67616d0000b2731f44db452a68e229650a302c,2024-11-10T16:17:44.204701052+07:00
673076b5e5eeda5ba3f9b9c4,damar,Mar lu masih inget gw ga? Dulu kita sering main bareng terus sama repal mar,6Ft6nfssjDYmgmXF19poJE,Cupid – Twin Ver. (feat. Sabrina Carpenter),"FIFTY FIFTY, Sabrina Carpenter",https://i.scdn.co/image/ab67616d0000b27372d259f38876162373275ed6,2024-11-10T16:02:45.045193769+07:00
67306f4fe5eeda5ba3f984d4,damar,"Haiiii, seneng bisa liat kamu happy kaya skrg walaupun bukan aku lagi yg disamping kamu, aku gamau liat kamu sedih anjay, aku gasuka kamu merasa diri kamu rendah di dpn aku, apapun kamu aku tetep jadiin kamu manusia favorit di hidup ak, pencapaian ak sama kamu memang pasti akan selalu berbeda ga akan sama, tapi buktinya aku pilih kamu dan ak suka semuanya tentang kamuuu, makasi sudah nepatin janji ya buat ga saling block setelah kita berdua ambil keputusan itu, aku harap kamu selalu happy, IMYSM🤍",0IktbUcnAGrvD03AWnz3Q8,Lucky,"Jason Mraz, Colbie Caillat",https://i.scdn.co/image/ab67616d0000b273125b1a330b6f6100ab19dbed,2024-11-10T15:31:11.397684044+07:00
67306c8fe5eeda5ba3f970d7,damar,galau,7Lm4S2P0MHwBktcdNILLQA,"Sialnya, Hidup Harus Tetap Berjalan",Bernadya,https://i.scdn.co/image/ab67616d0000b27327693aaf059002bba3a7655a,2024-11-10T15:19:27.748255836+07:00
6730665ae5eeda5ba3f9439f,damar,tidak ada harapan lagi selain menunggu,2wAiFWjRupWmnDkQcu91MF,Rumah Ke Rumah,Hindia,https://i.scdn.co/image/ab67616d0000b273d623688488865906052ef96b,2024-11-10T14:52:58.695882034+07:00
6730656ee5eeda5ba3f93cda,damar,"hai dam apa kabar, lama meki di nda ketemu dan maaf sekali karena putus ki tanpa alasan jelas dari aku tp pada akhirnya aku nyesel lepasin kamu aku pengen ngulang lagi kayak dulu. oh iya turut berduka cita ya mama kamu udh gak ada kamu jaga diri ya jangan buat bapak repot apa lagi mbak jangan dam, kurangin ngerokok nya minumnya juga jangan suka begadang lagi kalau ada kesempatan tahun depan kita ketemu lagi kok tp dengan kita yang udah asing kamu yang seperti gak kenal sm aku tp aku bersyukur masih bisa liat kamu
I really miss you
love you 
",4nyF5lmSziBAt7ESAUjpbx,"I miss you, I’m sorry",Gracie Abrams,https://i.scdn.co/image/ab67616d0000b27355c38bc34d1fe852f2657c2e,2024-11-10T14:49:02.444588936+07:00
67306401e5eeda5ba3f93299,damar,You here ?,3U4isOIWM3VvDubwSI3y7a,All of Me,John Legend,https://i.scdn.co/image/ab67616d0000b27394c9217a398f5174757c0c78,2024-11-10T14:42:57.29696591+07:00
67305dbae5eeda5ba3f907de,damar,jujur mAr gw suka bngD SMA looo.,1fDFHXcykq4iw8Gg7s5hG9,About You,The 1975,https://i.scdn.co/image/ab67616d0000b2731f44db452a68e229650a302c,2024-11-10T14:16:10.193584341+07:00
67305af3e5eeda5ba3f8f584,damar,I will wait for you until you might see me and know my feelings for you :((,0tgVpDi06FyKpA1z0VMD4v,Perfect,Ed Sheeran,https://i.scdn.co/image/ab67616d0000b273ba5db46f4b838ef6027e6f96,2024-11-10T14:04:19.254821136+07:00
67305600e5eeda5ba3f8d505,damar,"damar gua kangen Lo gua ingin Lo sekali lagi gua ga mau asing sama Lo ayo kembali ke gua gua kangen banget sama Lo,moga lu liat ini iya i love you ",2UgCs0i0rNHUH2jKE5NZHE,Sempurna,Andra & The Backbone,https://i.scdn.co/image/ab67616d0000b2730df7dec70511dd4f2e69dc34,2024-11-10T13:43:12.113697847+07:00
67305558e5eeda5ba3f8d100,damar,"kalau dunia jahat sama kamu bilang ya, kalau kamu ga ada tempat pulang aku akan jadi rumah buat kamu pulang atau sekedar bersender.-I LOVE YOU dmrfrrsmnzz",7nQoDLkzCcoIpKPQt3eCdN,Kau Rumahku,raissa anggiani,https://i.scdn.co/image/ab67616d0000b27332fa5c23a5c1cf200134e540,2024-11-10T13:40:24.202413323+07:00
67303ac6e5eeda5ba3f827bc,damar,kangen.,7F4tV8SiUy6itZTdAzdafO,penjaga hati,Nadhif Basalamah,https://i.scdn.co/image/ab67616d0000b2735c60335b52110564cbe57176,2024-11-10T11:47:02.177729903+07:00
673038b5e5eeda5ba3f81b33,damar,"Dam gua suka sama lu begooo!!!
Jangan nyuruh² terus gua jadian sama cowok lain karena yg gua suka itu elu gilaaa!",2gcMYiZzzmzoF8PPAfL3IO,"Untungnya, Hidup Harus Tetap Berjalan",Bernadya,https://i.scdn.co/image/ab67616d0000b27327693aaf059002bba3a7655a,2024-11-10T11:38:13.872593037+07:00
67302810e5eeda5ba3f7b7a8,damar,"damarr pekaa dikitt kekk, akuu sukaaa samaaa kamuuu",2plbrEY59IikOBgBGLjaoe,Die With A Smile,"Lady Gaga, Bruno Mars",https://i.scdn.co/image/ab67616d0000b27382ea2e9e1858aa012c57cd45,2024-11-10T10:27:12.324250165+07:00
67302470e5eeda5ba3f7a3f4,damar,menyerah ,5hkQFKFRrr5gKdbbxsg6Lj,Jakarta Hari Ini,"For Revenge, Stereo Wall",https://i.scdn.co/image/ab67616d0000b2735d91faeeeb5c97614c28faf0,2024-11-10T10:11:44.017783166+07:00
67302115e5eeda5ba3f79195,damar,"maybe in another life, we can be together.",46kspZSY3aKmwQe7O77fCC,we can't be friends (wait for your love),Ariana Grande,https://i.scdn.co/image/ab67616d0000b273c75a14e746ffe2030e8cd5da,2024-11-10T09:57:25.515774715+07:00
673020a3e5eeda5ba3f78f3e,damar,"Aku gak tahu Damar mana yang bakal baca ini tapiiii...
Buat A Damar aku mohon jangan nikah duluan yaaa tungguin aku dulu yang nikah baru kamu boleh nikah soalnya aku gak bisa kalo liat kamu nikah duluan sama cewek lain😭🤣
Ini aku serius lohhh😠",15xaVF0miqkphP0O0TZRs7,Kata Mereka Ini Berlebihan,Bernadya,https://i.scdn.co/image/ab67616d0000b2737d00871af1d2539ca4432e33,2024-11-10T09:55:31.727221366+07:00
67301923e5eeda5ba3f76959,damar,hh,6VggIDYOnf9C8fJVcMpxAu,Kangen,Dewa 19,https://i.scdn.co/image/ab67616d0000b27370ea19fd1f517d40b9c01c0d,2024-11-10T09:23:31.486412486+07:00
67300ba5e5eeda5ba3f72b6a,damar,ini beneran aku ada di galeri kamu😧😧,2X62SjtuwVQiGiZvZZ9Ztr,Rapsodi,JKT48,https://i.scdn.co/image/ab67616d0000b273dcd3a934c5c00bdfc1fd4d5c,2024-11-10T08:25:57.67909882+07:00
67300550e5eeda5ba3f7128f,damar,jangan pergi yaa,2dIBMHByUGcNPzmYBJ6OAj,Evaluasi,Hindia,https://i.scdn.co/image/ab67616d0000b273d623688488865906052ef96b,2024-11-10T07:58:56.269193668+07:00
672feb61e5eeda5ba3f6c481,damar,"hai dam  maksih ya dam maksih yah udh bertahan sejauh ini aku mungkin gatau masalah apa,yang kamu lgi lewati sekarang tapi intinya tetap semangat ya.always proud you dam oh iya smoga kamu msuk kampus ,impian mu ya setelah lulus nanti ttep jdi damar yg aku kenal ya. because your happiness is also my happiness, and I will definitely wish you the best
#form bocil",1fDFHXcykq4iw8Gg7s5hG9,About You,The 1975,https://i.scdn.co/image/ab67616d0000b2731f44db452a68e229650a302c,2024-11-10T06:08:17.031572422+07:00
672fe96fe5eeda5ba3f6c077,damar,"in my monochrome world, I want to see and feel colour again",5TTGoX70AFrTvuEtqHK37S,No. 1 Party Anthem,Arctic Monkeys,https://i.scdn.co/image/ab67616d0000b2734ae1c4c5c45aabe565499163,2024-11-10T05:59:59.416297254+07:00
672faeafe5eeda5ba3f66c72,damar,"HAII AKU HARAP KAMU BAHAGIA YA. kamu pernah ingat ga aku berjuang bertahun-tahun untuk nunggu kamu dan sudah 4 tahun berlalu tetapi kamu malah milih orang lain daripada aku yang udah tulus sama kamu, semua hal sudah aku maafin tapi kamu tau ga? no man can handle me :( sedih? banget rasanya yang ngertiin aku tuh cuma kamu dew tapi kamu lebih milih melepaskan kita yang udah mau 5 tahun demi orang lain but it's okayy semangat pramuka nya boss!!",01beCqR9wsVnwzkAJZyTqq,I Love You but I'm Letting Go,Pamungkas,https://i.scdn.co/image/ab67616d0000b27304d4b84c6eb6b24d61bbd963,2024-11-10T01:49:19.162297887+07:00
672f98efe5eeda5ba3f62216,damar,"hi dam, aku gatau kamu baca catatan aku ini atau ga tapi in another life kita bisa sama"" lagi kan? aku nyesel ninggalin km, aku gatau harus ngapain hari itu, perasaan aku ke kamu bener"" bikin bingungg, pdhl kamu orang yg aku suka awal mpls, orang yg bener"" aku pengen, tapi pas aku punya hub sama kamu semua itu biasa aja, aneh ya? aku yg ninggalin aku yg gamon, perasaan aku ke kamu ga bakal berubah dam tetep sama, ilysm",2IVsRhKrx8hlQBOWy4qebo,Mr. Loverman,Ricky Montgomery,https://i.scdn.co/image/ab67616d0000b27367ee332af483acd134fd6fd0,2024-11-10T00:16:31.558556424+07:00
