_id,recipient,message,song_id,song_name,song_artist,song_image,created_at
6851fe8c17e1fe68eff79725,damar,"damar u're soo soo soo perfect.. i have had a crush on you since the first sight yesterday
— room",790xAaylcgzyKm40GM95Gl,missin something,Zach Templar,https://i.scdn.co/image/ab67616d0000b27377d12d18045a0cb69e3d687a,2025-06-17T23:47:24.956782555Z
68518f6417e1fe68eff7895a,damar,"abis coba ngomong sama kamu lagi, aku baru sadar, ternyata aku gak sebutuh itu sama kamu lagi, people change, i change, and u changed. ternyata, memang kita ini biasa aja. gak sebutuh itu wkwk",2eAvDnpXP5W0cVtiI0PUxV,Dandelions,Ruth B.,https://i.scdn.co/image/ab67616d0000b27397e971f3e53475091dc8d707,2025-06-17T15:53:08.936589113Z
684ea18917e1fe68eff6fde5,damar,pacaran sama kamu ajalah,4E8rZD1xKIbof0vUkyHJLn,"Here, There And Everywhere - 2022 Mix",The Beatles,https://i.scdn.co/image/ab67616d0000b2734a4c7445df9b3719a60eb53b,2025-06-15T10:33:45.290970971Z
684e6a1a17e1fe68eff6f464,damar,"gw harap gw gaketemu sama orang kaya lu lagi, makasih ya udah nguras rasa cinta gw dan semoga lu bahagia disana ",4iMfYGWDKKuP79CAqsKd3n,NEVER MET! (feat. Glitch Gum),"CMTEN, Glitch Gum",https://i.scdn.co/image/ab67616d0000b273f922d9c3fbadeef1e2597377,2025-06-15T06:37:14.919742411Z
684d6c3b17e1fe68eff6c92d,damar,"my name is not ""alexandra"" but you can call me anything you want",6ZGgaShxOimGDfRz1T1zje,Alexandra,Reality Club,https://i.scdn.co/image/ab67616d0000b2736019b1ddb28634421cc291a0,2025-06-14T12:34:03.127356088Z
684bfd1c17e1fe68eff6875b,damar,"If you see this message, this is for you, Damar R. Thank you for living, thank you for everything. I know it's hard to live your own life, but please never give up on your live, because i wanna see you grow your wings. I love you, i love you even for a thousand years. ",2fuYa3Lx06QQJAm0MjztKr,Let Down,Radiohead,https://i.scdn.co/image/ab67616d0000b273c8b444df094279e70d0ed856,2025-06-13T10:27:40.558090903Z
684ae12417e1fe68eff657b4,damar,"hello damar! damar, terimakasih ya sudah menjadi pendengar yang baik untuk selama ini, maaf kalau aku bawel dan suka mengirim foto foto tidak jelas. thank you for being a good person to myself and others, I am very happy to meet you. I hope I can continue to be friends with you, from today, tomorrow, and the next day.",34xTFwjPQ1dC6uJmleno7x,Godspeed,Frank Ocean,https://i.scdn.co/image/ab67616d0000b273c5649add07ed3720be9d5526,2025-06-12T14:16:04.241101806Z
6848360017e1fe68eff5d155,damar,"kenapa ya dam, kamj selalu aja bikin aku kepikiran sama kamu? padahal saling komunikasi aja gapernah hahaha, aku harap disuatu saat nanti kita bisa bersatu yaa! love you..",0e2wfbDK7ppotqyUWD7qs8,La La Lost You - Acoustic Version,"NIKI, 88rising",https://i.scdn.co/image/ab67616d0000b2738b0e2044b4b20f24908f7122,2025-06-10T13:41:20.379383626Z
684834ee17e1fe68eff5d0ee,damar,"halo damar, aku tau nama ""damar"" itu ga cuma kamu, but i wish, kamu baca ini.. dam, aku tuh bener² suka sama kamu, cuma karena kamu aku jadi ga tertarik sama orang² diluar sana yang mungkin aja bisa lebih baik dari kamu, tapi rasa gabisa bohong damar.. aku tahu kamu gabakal pernah suka balik sama aku. so, have fun damar!",0e2wfbDK7ppotqyUWD7qs8,La La Lost You - Acoustic Version,"NIKI, 88rising",https://i.scdn.co/image/ab67616d0000b2738b0e2044b4b20f24908f7122,2025-06-10T13:36:46.507683447Z
6847e46617e1fe68eff5b9c3,damar,"selamat soreee damm, tbh i miss u so bad today..",0bht8SpPHXiUMApKcua4Mz,Take Care,NIKI,https://i.scdn.co/image/ab67616d0000b2734d3d3963c551df56736050f1,2025-06-10T07:53:10.142003166Z
684700d517e1fe68eff58dda,damar,tiba² keinget dulu aku pernah suka sm kamu soalnya sekelas di EF bogor wkwk dulu semangat EF karna kmu,1Ib0UNLoqBEWTmBvXeFSni,Pemuja Rahasia,Sheila On 7,https://i.scdn.co/image/ab67616d0000b273f0a7efc94687cc049b821529,2025-06-09T15:42:13.55480996Z
6846da0517e1fe68eff57bc0,damar,"semesta tau kamu orang baik. jadi hal baik selalu bersama mu, kamu orang baik. selalu kuat ya di setiap langkah yang kau buat, ada aku yang selalu mendoakan mu ",4eAhp402meOIEhybaebmyJ,Ribuan Memori,Lomba Sihir,https://i.scdn.co/image/ab67616d0000b2736062de27beabb8e0bc8e9cf2,2025-06-09T12:56:37.423174122Z
684691460e86f2be736f2b3a,damar,"hi ex, I miss u so much. ty for being my first experience sayang, sorry selama menjadi ""kita"" aku jdi pasangan yang buruk, gabisa mengerti kamu, ndak isa jadi cewe yang kamu pingin i, please be happy with you're girlfie ya bb. melihatmu bahagia, aku juga bahagia walaupun sudah tak bersamamu. love ya",4SqWKzw0CbA05TGszDgMlc,I Love You So,The Walters,https://i.scdn.co/image/ab67616d0000b2739214ff0109a0e062f8a6cf0f,2025-06-09T07:46:14.688687903Z
684680cf0e86f2be736f265f,damar,"hai, dam.., kita sekarang asing bnget ya? aku kngen tapi aku juga harus sadar diri bahwa aku yang duluan ngelepas kamu, btw ini dari dea ya, ilysm damar..",0FTmksd2dxiE5e3rWyJXs6,back to friends,sombr,https://image-cdn-ak.spotifycdn.com/image/ab67616d0000b2739d24f74c1e2d8a12b1e591ec,2025-06-09T06:35:59.883037172Z
68462f370e86f2be736f1266,damar,"hii dam day ke 3 yaa aku ngirim pesan kayak gini, aku bingung harus kangen sama kamu pakek gaya apa lagi i really miss u dam, kita udh bener bener ga bisa ya?tolong kasih tau aku gimana cara untuk move on dari kmu....
mungkin itu aja yg ingin aku sampaikan walau ga akan tersampaikan ke kmu ilysm🤍",37mbA1RwYja7WFaIOzSczX,You'll Be In My Heart - Spotify Singles,NIKI,https://i.scdn.co/image/ab67616d0000b273e685202d0eed2a82db075576,2025-06-09T00:47:51.97485681Z
6845b9fa1fc54584f672d7d4,damar,"how's ur day? semoga ga baik baik aja deh, gua benci lo sampe kapan pun mar.",2U3jOPfO4wZZFaaWS4Dcj6,stranger,Olivia Rodrigo,https://i.scdn.co/image/ab67616d0000b2734063d624ebf8ff67bc3701ee,2025-06-08T16:27:38.41537302Z
68450ba11fc54584f6728f1e,damar,"entah berapa kali aku mau ngungkapin perasaan aku yang sebenarnya ke kamu, ka...sebentar lagi kamu lulus & aku harap saat aku sma/smk bisa satu sekolah lagi sama kamu, beribu kali aku mau buka hati aku buat orang baru entah kenapa perasaan aku masih ada dikamu, barusan banget aku mimpiin kamu sebelum tidur aku gaada mikirin kamu, kapan kita ketemu lagi? be happy ya ka",2qpacEyFxmbxCpIEqZkqvC,You Are the Right One,Sports,https://i.scdn.co/image/ab67616d0000b273348a296903dc1073e96da17e,2025-06-08T04:03:45.195226023Z
6844d3d71fc54584f6727e28,damar,"hi ini day 2 aku ngirim pesan lagi ini ke kmu yaa walaupun aku tau ga akan di baca sama kmu tapi its okayy aku seneng ngelakuin ini semua ke kamu, i mis u so much, sedih tau aku kangen sama kmu tapi aku ga bisa berbuat apa apa kira kira kmu kangen sama aku juga yaa aku seneng bisa kenal sama kmu love you🤍",3ZwqWrRpylU9nfy99qwKdR,Pelangi,Hivi!,https://i.scdn.co/image/ab67616d0000b273abbee551b5c821d7624949ae,2025-06-08T00:05:43.620335092Z
684493f41fc54584f67273fb,damar,"aah, i love you so bad dam. JANGAN NGESELIN KENAPAA SIIHHHH",557XVqKgnYAxvvyczr2zDg,THANK YOU 4 LOVIN’ ME,Paul Partohap,https://i.scdn.co/image/ab67616d0000b273eec9dbf44607a72f9deab6ef,2025-06-07T19:33:08.211219832Z
684492221fc54584f672736b,damar,"semua orang tau aku sayang kamu, i love you damar. jangan bosen sama aku yaa",557XVqKgnYAxvvyczr2zDg,THANK YOU 4 LOVIN’ ME,Paul Partohap,https://i.scdn.co/image/ab67616d0000b273eec9dbf44607a72f9deab6ef,2025-06-07T19:25:22.756437154Z
684454761fc54584f6724d1b,damar,i miss u so much,0FTmksd2dxiE5e3rWyJXs6,back to friends,sombr,https://image-cdn-ak.spotifycdn.com/image/ab67616d0000b2739d24f74c1e2d8a12b1e591ec,2025-06-07T15:02:14.815880488Z
684448321fc54584f6724612,damar,"guess who's me? HAHAHA, gue gak tau apa lo sadar atau engga, tapi gue lah org yg lagi jatuh hati ke lo (sebenernya udah dari awal kita sekelas tapi gue kebanyakan denial sm perasaan gue wkwk) lucu aja ketika kita ngobrol dan ternyata banyak jg kesukaan kita yg sama, kyk apa ya? buat gue, nyaman dan nyambung aja gitu ngobrol sm lo. sebenernya ini bukan confession sih, cm mau ngasih tau aja. hadeh dasar mas mas jogja, ngerepotin hati gue lo mah, stop muncul mulu dipikiran gue every single time 🙄",1qrpoAMXodY6895hGKoUpA,You Belong With Me (Taylor’s Version),Taylor Swift,https://i.scdn.co/image/ab67616d0000b273a48964b5d9a3d6968ae3e0de,2025-06-07T14:09:54.883976781Z
6843ea031fc54584f6722a2b,damar,"hi, is been awale yaa dari kita asing, aku ga pernah bener bener move on si sebenarnya tapi aku lihat kmu baik baik ajaa setelah kita no komunikasi, i always love you tapi mungkin kita emng bener bener ga bisa sama sama i hope you'll always happy and mendapat kan cinta yg kmu ingin kann i mis u so much🤍",15LSJbO8lAck7j25HBA581,i've always loved you,Arash Buana,https://i.scdn.co/image/ab67616d0000b273687cac266673242dbb6ec682,2025-06-07T07:28:03.880999633Z
684274fa1fc54584f671db3e,damar,"I saw you on stage and thought you're really cool, I really like your voice too, decent for a guy. I had this fav song of mine, though it seems like I couldn't find it here. Imo, Jonas Brothers songs fits you well. The song I'm talking abt is ""Summer Baby"" by Jonas Brothers, but this one's good too! I hope you give it a try. And lastly, I know It's quite early to say this but happy graduation for the both of us. Hope we can meet someday! ",4qu63nuBpdn0qHUHuObEj1,Leave Before You Love Me (with Jonas Brothers),"Marshmello, Jonas Brothers",https://image-cdn-ak.spotifycdn.com/image/ab67616d0000b273ae40468931087f78919b86ce,2025-06-06T04:56:26.759388931Z
6841b1cb1fc54584f671bd87,damar,"damar knp km gasuka balik sma aku jir? kita sekelas dn aku uda naruh perasaan wkwk, hrusnya si drdulu gausa ya ini baper krn fashion show ",77vx7sGjdqwdnQL968t8oY,Monolog,Pamungkas,https://i.scdn.co/image/ab67616d0000b27304d4b84c6eb6b24d61bbd963,2025-06-05T15:03:39.31064186Z
683f042a1fc54584f67131b6,damar,"aku sedih banget karena ga bisa denger kabar kamu, mau di wa, ig, tiktok atau apapun itu. aku ngerasa kamu hilang dan seakan-akan ga pernah ada di hidup aku. aku takut kalau keberadaanku seberpengaruh itu sama kehidupan kamu yang sekarang, aku takut kamu sengsara tanpa aku :( kamu aja jarang cerita sama orang tua dan temen deketmu sendiri, terus kamu cerita ke siapa sekarang pas aku udah ga disisi kamu? kita beneran ga bisa balik kaya dulu ya...?",3QaPy1KgI7nu9FJEQUgn6h,WILDFLOWER,Billie Eilish,https://i.scdn.co/image/ab67616d0000b27371d62ea7ea8a5be92d3c1f62,2025-06-03T14:18:18.087919642Z
683e3fb11fc54584f670fc40,damar,"heh, lu ngeselin bgt anjir. tapi gua sayang sm lu..",2U3jOPfO4wZZFaaWS4Dcj6,stranger,Olivia Rodrigo,https://i.scdn.co/image/ab67616d0000b2734063d624ebf8ff67bc3701ee,2025-06-03T00:20:01.014860822Z
683debab1fc54584f670f367,damar,"jujur, rasanya sedih banget waktu kamu liat sg ku tapi ga bales dm ku. aku ngga tau yang kamu lakuin itu adalah cara buat lupain aku, atau kamu emang udah benci sama aku, aku bingung. tiap hariku isinya cuman mikir kenapa kita bisa jadi sejauh ini dalam waktu yang singkat. aku kangen chat kamu tiap hari, aku kangen nyeritain keseharian ku ke kamu mau sekecil apapun itu. aku beneran kangen, banget :( dada ku sakit tiap kali keinget nama kamu sekaligus kenangan yang pernah kita ukir bersama. dan kamu udah ngga disini lagi buat nenangin aku.",0bht8SpPHXiUMApKcua4Mz,Take Care,NIKI,https://i.scdn.co/image/ab67616d0000b2734d3d3963c551df56736050f1,2025-06-02T18:21:31.818780221Z
683dc1111fc54584f670e127,damar,"i tried to get u off on my mind but imysm i hope u still remember me 












from L",3nqqDo8CcCLke3ZoTgiOKf,The Man Who Can't Be Moved,The Script,https://i.scdn.co/image/ab67616d0000b273f33a9f529c12f79b116eb218,2025-06-02T15:19:45.126943258Z
683d9efe1fc54584f670ceb3,damar,"ini masih aku, orang yang sama. aku beneran kangen banget sama kamu, damar. tapi di sisi lain aku merasa udah bikin hidup kamu jadi makin menderita. harusnya, kehadiran aku bikin kamu merasa lebih baik. harusnya, kehadiran aku bikin kamu merasa berharga dan berhak buat bahagia. tapi, malah sebaliknya. aku tau kamu ga akan baca pesan ini, tapi aku berharap Tuhan bakal menyampaikan ini meskipun faktanya kita beda keyakinan. aku minta maaf karena belum bisa lepas dari kamu sepenuhnya, aku minta maaf karena belum bisa jadi yang terbaik bagi kamu. aku harap kamu ga merasakan kesedihan seperti yang aku rasain, karena aku tau hidup kamu udah berat. satu hal pasti yang ga akan berubah, aku bakal selalu sayang sama kamu, mau sampai kapanpun itu. kamu itu pengalaman pertama bagiku, sekaligus pengalaman paling bahagia meskipun akhirnya kita tetep harus pisah. tapi gapapa, rasa sayangku masih tetep sama kok. aku harap kamu bisa cepet nemuin kebahagiaan kamu yang baru yaa, i love you so much. now and forever. <3",6GCW5Muk3u0cM5QTkS4C9a,The One That Got Away,Katy Perry,https://i.scdn.co/image/ab67616d0000b27343219fb4e2c45a0b7df6ef87,2025-06-02T12:54:22.57335243Z
683d76801fc54584f670bd3e,damar,"sorry for not being able to stay with you any longer, i hope you'll soon find somebody to replace me, who has the same religion as you. i love you so much, if only you know.",01beCqR9wsVnwzkAJZyTqq,I Love You but I'm Letting Go,Pamungkas,https://i.scdn.co/image/ab67616d0000b27304d4b84c6eb6b24d61bbd963,2025-06-02T10:01:36.816562711Z
683c77eb1fc54584f67072e2,damar,imy,2U3jOPfO4wZZFaaWS4Dcj6,stranger,Olivia Rodrigo,https://i.scdn.co/image/ab67616d0000b2734063d624ebf8ff67bc3701ee,2025-06-01T15:55:23.523389756Z
683c4e9e1fc54584f67055ad,damar,"To be honest, lately I've been thinking about you all the time",37R0bQOQj5a7DOqh1TGzvB,One Call Away,Charlie Puth,https://i.scdn.co/image/ab67616d0000b273633a2d775747bccfbcb17a45,2025-06-01T12:59:10.333711682Z
683a64f61fc54584f66f6149,damar,"hi, kalo kamu baca ini aku harap kamu tau perasaan ku dri kelas 7 sampai sekarang masi sama. . . aku seneng liat kamu bahagia, dan aku berharap kamu selalu bahagia",15LSJbO8lAck7j25HBA581,i've always loved you,Arash Buana,https://i.scdn.co/image/ab67616d0000b273687cac266673242dbb6ec682,2025-05-31T02:09:58.259323799Z
6839cfe71fc54584f66f217a,damar,"Hai mar, have a nice day, My Iris,,,
Tau ga sih, aku gak suka liat orang lain risih dan canggung karena aku, dan kamu salah satunya. And, u know? Selama ini aku ga pindah hati, aku cerita ke orang kalau aku suka orang lain, padahal dalam hati aku masih liat ke kamu. Aku cuma ga pengen bikin kmu risih mar, ga suka liat kamu canggung ke aku. Maaf yaa bikin kamu ga nyaman. Aku gak ganggu kok mar, ayo tetep temenan ya marrr.",6Qyc6fS4DsZjB2mRW9DsQs,Iris,The Goo Goo Dolls,https://i.scdn.co/image/ab67616d0000b273eda9478c39a21e1cdc6609ca,2025-05-30T15:33:59.915820216Z
6839a3cc1fc54584f66f06db,damar,"kenapa sih kmu hrus punya banyak mantan/hts.
bikinn banyak pikiran tau gak mana cantik² lagii kalah saing aku, udahlah bodoamat",15LSJbO8lAck7j25HBA581,i've always loved you,Arash Buana,https://i.scdn.co/image/ab67616d0000b273687cac266673242dbb6ec682,2025-05-30T12:25:48.690376668Z
68395f7e1fc54584f66ee41a,damar,"kalo mungkin suatu saat kamu liat ini,
ada 2 ke mungkian. lagi deket sama aku, atau lagi deket sama yang lain. yang jelas intinya aku suka sama kamu udah lama,
 love you - ainun",1fDFHXcykq4iw8Gg7s5hG9,About You,The 1975,https://i.scdn.co/image/ab67616d0000b2731f44db452a68e229650a302c,2025-05-30T07:34:22.093847495Z
6835def81fc54584f66e6393,damar,i think i might’ve fallen for you since the third day we went to jogja,1ctbkptXLNIoEVTNAFYV4d,I Like U,NIKI,https://i.scdn.co/image/ab67616d0000b273a18ae038fa4b0519e5e3420e,2025-05-27T15:49:12.232788798Z
6830b31c1fc54584f66dada6,damar,"I've moved on from you, but every time I see you again it hurts dafug. btw u're my iris",6Qyc6fS4DsZjB2mRW9DsQs,Iris,The Goo Goo Dolls,https://i.scdn.co/image/ab67616d0000b273eda9478c39a21e1cdc6609ca,2025-05-23T17:40:44.510161437Z
682cab8a1fc54584f66d1d2a,damar,"Hiii D!,  ini uda ketiga kalinya aku nulis ini buat kamu uda ke 3 kalinya juga kamu muncul di mimpiku holding my hand and hugging me. Gimana kabar mu sipaling sibukkk semangat yaa aku selalu merhatiin kamu dari jauh walaupun kita udah ga kaya yang dulu lagi its okay aku ngerti kok 😁",4PwWESSlTwzvw9B7bmtTLS,anything,Adrianne Lenker,https://i.scdn.co/image/ab67616d0000b273ab009ce861613653b14451b9,2025-05-20T16:19:22.147058238Z
6829c07c1fc54584f66ca812,damar,"deymmmm, why is it so hard for me to hold back my feelings for you",1l4pW7Tklvcc3k38rDFMkk,Touch,Cigarettes After Sex,https://i.scdn.co/image/ab67616d0000b273fd275af89cec73d6287f9cbf,2025-05-18T11:11:56.191864913Z
6828341e1fc54584f66c6f4c,damar,"haloo kaa mungkin kaka lupa sm aku tapi kita pernah ngobrol kok pas km lagi absen, btw senyum km manisss bgtt. semangat yaa",0bht8SpPHXiUMApKcua4Mz,Take Care,NIKI,https://i.scdn.co/image/ab67616d0000b2734d3d3963c551df56736050f1,2025-05-17T07:00:46.686353674Z
68278b601fc54584f66c60c1,damar,"you’ll never know how many nights i stayed up,
wondering if you ever felt the same.
you kept your distance just enough,
but close enough to keep me hanging.
i’m not mad.
justt heart full and tired.
i wish things were different.
i wish we were different.
but if this is it,
then i hope you never forget how much i cared.
even when i had to pretend i didn’t.
godspeed, always/y
",34xTFwjPQ1dC6uJmleno7x,Godspeed,Frank Ocean,https://i.scdn.co/image/ab67616d0000b273c5649add07ed3720be9d5526,2025-05-16T19:00:48.09143203Z
681f69691fc54584f66b11dd,damar,"mungkin kamu orang yang lebih membuatku senang, makasih atas perjalanan kita yang bersama lalu putus pada akhirnya, hubungan kita singkat ya? kangen, pengen akrab lagi, tapi kayaknya kamu ga peduli deh, chat aja jangan ragu, kalau aku duluan.. haha masa aku si? nanti aneh kan? sehat sehat yaa",1xu91y5jf13yxAssdfsbPt,In Love With Another Man,Jazmine Sullivan,https://i.scdn.co/image/ab67616d0000b273ebcc9144c41ae7d42efe6d94,2025-05-10T14:57:45.576548788Z
681725711fc54584f6697752,damar,"hai ka, apa kabar? semoga baik terus ya, sekarang udah lebih baik dari sebelum nya ya? bahagia terus ya ka, aku salah satu orang yang seneng liat kaka bahagia, miss u dikit wkwk ",1JaYUkmogrNYPhHTyqg9Ft,Dan Bandung,Pidi Baiq,https://i.scdn.co/image/ab67616d0000b273da3fd5e5431363f2124ab0b5,2025-05-04T08:29:37.190881361Z
6817060e1fc54584f6696a2f,damar,"hai kak!
nyesel banget baru tau orang kaya kamu disekolah pas mau lulus hahahaha, tapi setidaknya aku dapet momen dikit sama kamu pas di basket sejujurnya belum ada yang tau klo aku suka kamu AKU MALU BANGET PLS, SEMOGA KITA SATU SEKOLAH LAGI YA KAK!!!!! i like you kak ☹️",4idi4ZCAle2ZTsY1DDwZUM,Itu Aku,Sheila On 7,https://i.scdn.co/image/ab67616d0000b273f0a7efc94687cc049b821529,2025-05-04T06:15:42.45291977Z
6816fd031fc54584f6696581,damar,"bingung bgt mau nyampein ke km kaya gmn, i wish km liat ini yaa",1Ib0UNLoqBEWTmBvXeFSni,Pemuja Rahasia,Sheila On 7,https://i.scdn.co/image/ab67616d0000b273f0a7efc94687cc049b821529,2025-05-04T05:37:07.481609681Z
6816da901fc54584f6695485,damar,"ilysm, mas damar",1ylY6UrF7cmOZ9GDOxrfk8,Bila Kau Tak Disampingku,Sheila On 7,https://i.scdn.co/image/ab67616d0000b273e8d4f0596d66ccbe5241918d,2025-05-04T03:10:08.255150339Z
6816a4431fc54584f6694026,damar,"pls I don't want to be a stranger to you, but I'm also tired of looking for topics like I'm the only one who wants to chat lol. ketua pamit undur diri, capek se capek capek nya woy
kakakcu ga bakal liat ini kan 😜😜
",2hHeGD57S0BcopfVcmehdl,Hati-Hati di Jalan,Tulus,https://i.scdn.co/image/ab67616d0000b273d34a0632f6861e8875d6899b,2025-05-03T23:18:27.108535453Z
6815908c1fc54584f66908e5,damar,"stay with mee damarrr, take a chance wimme kalau bisa WKWKWKW ",21acb66djKRlDPJOXRBCkc,Take A Chance With Me,NIKI,https://i.scdn.co/image/ab67616d0000b273d3997a4c208ac08dafff374f,2025-05-03T03:42:04.482505256Z
6814a5621fc54584f668e4e3,damar,"mar gua kangen banget sama lo, abis liat arsip ig sedih bgt gakuat, makasih yaa udh ngisi kebahagian masa remaja gua, seneng bgt bisa kenal dan bahkan jadi pacar lo selama bertahun tahun, maafin gua ya kalau selama itu gua nyakitin lo, semoga di lain waktu kita bersama lg ya mar:( damar fans barcelona",2U3jOPfO4wZZFaaWS4Dcj6,stranger,Olivia Rodrigo,https://i.scdn.co/image/ab67616d0000b2734063d624ebf8ff67bc3701ee,2025-05-02T10:58:42.170507155Z
681321701fc54584f668ae10,damar,"ka?im so sorry for bothering you, janji deh yang di tiktok kemaren terakhir😓
hope you shs moment lebih baik dari sekarang ya...
sorry for being ""geer"" karna ngira kamu suka sama aku juga eh ternyata...
udaa yaww makacii💘
",1ylY6UrF7cmOZ9GDOxrfk8,Bila Kau Tak Disampingku,Sheila On 7,https://i.scdn.co/image/ab67616d0000b273e8d4f0596d66ccbe5241918d,2025-05-01T07:23:28.024705523Z
680fa6c31fc54584f6683212,damar,"hai kaa??semoga kamuu liat ini yaaaww!!
aku naksir kamu ka.. gatau anjir kok bisa dan dari kapan aku naksir kamu..
stop kasi mixed signal pliss:<
hehe semoga kamu bacaaa yaaaww
clue nyaa = agit 9.8🫣 
(gatau waktu di baca udah lulus ataw belum hihi)
clue pengirim:genit 🤓
sekian terimakasih👾",4AhWZsG1kb8URNISpRRv9S,Kala Cinta Menggoda,Chrisye,https://i.scdn.co/image/ab67616d0000b273875283b08596b91b413d70fb,2025-04-28T16:03:15.293232123Z
680dec6b1fc54584f667e329,damar,"hai kaa, jujur aku pengen kenalan sm kamu ^^ btw salken ya kaa  (⁠◠⁠‿⁠◕⁠)

ka damar anak gapul
-dekel kls 8",1Ib0UNLoqBEWTmBvXeFSni,Pemuja Rahasia,Sheila On 7,https://i.scdn.co/image/ab67616d0000b273f0a7efc94687cc049b821529,2025-04-27T08:35:55.210956092Z
680a2b501fc54584f667232d,damar,"

hai kamu, yang lagi sibuk di pondok
aku cuma mau bilang, aku kangen banget. kangen semuanya tentang kamu,suaramu, candaanmu yang ngeselin tapi bikin senyum, dan kehadiranmu yang selalu nenangin. aku ngerti kamu lagi fokus, dan aku dukung itu, tapi kangen ini nggak bisa diem. cma pengen kamu tau aja aku nungguin kamu balik cerita lagi kayak biasa

",0bht8SpPHXiUMApKcua4Mz,Take Care,NIKI,https://i.scdn.co/image/ab67616d0000b2734d3d3963c551df56736050f1,2025-04-24T12:15:12.657546262Z
680a06571fc54584f66710fe,damar,"hi there, aku gatau kamu bakal baca ini kapan kak wkwk but i hope u know, how much i miss u and i love u, i'm sorry for everything, i know i'm such a fool for you. kangen liat kamu di sekolah hehe dasar ketua basis jamet, aku kangeeeennnnn jameeeeettt.
makasih ya, karena tanpa sadar kamu bikin aku punya cerita buat diinget, bahkan di hari-hari yang keliatannya biasa aja. dan maaf, kalo aku masih belum bisa bener-bener ngelepas semuanya. 

-someone u know in nov, 2022",68FHdrL6dbruEBrfLjR52a,Paths,NIKI,https://i.scdn.co/image/ab67616d0000b2734d3d3963c551df56736050f1,2025-04-24T09:37:27.887364674Z
6809e94e1fc54584f6670278,damar,imy,2U3jOPfO4wZZFaaWS4Dcj6,stranger,Olivia Rodrigo,https://i.scdn.co/image/ab67616d0000b2734063d624ebf8ff67bc3701ee,2025-04-24T07:33:34.111268507Z
6809e0541fc54584f666fd97,damar,mis u,2U3jOPfO4wZZFaaWS4Dcj6,stranger,Olivia Rodrigo,https://i.scdn.co/image/ab67616d0000b2734063d624ebf8ff67bc3701ee,2025-04-24T06:55:16.255446507Z
6809992d1fc54584f666e223,damar,lucu yaa,1w3azB0VuRFp79AduIwrIy,P.S. I LOVE YOU,Paul Partohap,https://image-cdn-fa.spotifycdn.com/image/ab67616d0000b27303769726e96538c554af7c61,2025-04-24T01:51:41.442660797Z
68097cdd1fc54584f666dc5c,damar,"i miss u so muchh :( no words can explain how much i wanna talk to you again, how i wanna smile bcs of ur text, how im staying late to answer your chat..",5TpPSTItCwtZ8Sltr3vdzm,Last Night on Earth,Green Day,https://i.scdn.co/image/ab67616d0000b273c2ced39899b0d67cd5a724fa,2025-04-23T23:50:53.17390225Z
680601e21fc54584f665c2bf,damar,"I always think of u every night, but you have gf, and we close by fiction:>",18UsAG7SfOQ5sxJEdjAMH0,Be My Mistake,The 1975,https://i.scdn.co/image/ab67616d0000b2736c582022e90b11f0da287a9a,2025-04-21T08:29:22.339417447Z
680600421fc54584f665c283,damar,I think I like you not as a friend.,2TgxCUZdHFkPEVmFge1OSd,Fallingforyou,The 1975,https://i.scdn.co/image/ab67616d0000b273ebcc3ef64dbef8acb47e2960,2025-04-21T08:22:26.562905257Z
68022aab1fc54584f66538d7,damar,"udh ya, jgn gamon lagi WKWKWKWK cape tau jd backburner dam",3QaPy1KgI7nu9FJEQUgn6h,WILDFLOWER,Billie Eilish,https://i.scdn.co/image/ab67616d0000b27371d62ea7ea8a5be92d3c1f62,2025-04-18T10:34:19.589525509Z
67ff74bc1fc54584f664da23,damar,"ADA ORG LAGI SELINGKUH, search “Kesayangan. “ (pake spasi 1 kali)
",2U3jOPfO4wZZFaaWS4Dcj6,stranger,Olivia Rodrigo,https://i.scdn.co/image/ab67616d0000b2734063d624ebf8ff67bc3701ee,2025-04-16T09:13:32.199062132Z
67ff74a51fc54584f664da1b,damar,"skrng 16 april 2024 dan yap ak masi sering kepikiran kmu, bahkan aku selalu kepikiran km SETIAP SAAT.
tapi kayanya kmu udah ada yang baru ya?? gpp sih (meren) kalo kamu lihat, kasii taw ak yaw.
btw ak ganti nomor, maw minta sv sama kamuu tp maluu hehe",2U3jOPfO4wZZFaaWS4Dcj6,stranger,Olivia Rodrigo,https://i.scdn.co/image/ab67616d0000b2734063d624ebf8ff67bc3701ee,2025-04-16T09:13:09.184210419Z
67ff48401fc54584f664d429,damar,"Keliatan kan sekarang siapa yang gak bener? Haha!!! 
Aku masih sama dia, dan kamu gonta ganti terus cewek semenjak kita asing😏
Btw aku kenal sama dia juga pas udah beberapa bulan asing, gak kayak kamu yang langsung sama yang lain ketika udah putus. 
",1GCbc1vpkZA2zhjsSFhmHT,Fuck You,Lily Allen,https://i.scdn.co/image/ab67616d0000b2737124b6bf785117033d003590,2025-04-16T06:03:44.13887492Z
67fe74e41fc54584f664bdba,damar,"woi lu damar yang ngaku ngaku anak teknik mesin ugm, trus katanya pindah ke uty, trus ga lama pindah untag semarang, lu sebenernya siapa sih anjir??? jangan kegeeran yaa gue tanya begini karena sebenernya gue ilfeel LOL ga masuk akal semua cerita lu btw. lu faker yaa??? gue b aja sih selama chat sama lu cuma kalo lu beneran faker semoga cepetan tobat deh umur gaada yang tau. kalo boleh ngulang waktu gue jujur nyesel dm an sama lu sampe move wa tapi yaudah lah ya semoga gue ga ketemu orang modelan kaya lu (jual cerita sedih, dll)",3L5gk3sesbQIvymuKbImuM,Ratna Anjink,"Lil Salmonela, Lil Kujang",https://i.scdn.co/image/ab67616d0000b2739edf705ff97263e916f8dfbb,2025-04-15T15:01:56.652142757Z
