_id,recipient,message,song_id,song_name,song_artist,song_image,created_at
6751312148d1613d5f269624,damar,"halooo mar, kek nya aku emg beneran suka sama mu lah, hahaha. setiap kita ada momen tuh rasanya kek bahagiaaa kaliiii apalagi pas km ngechat aku (padahal cuma gitu) tapi itu tuh berarti kali, mar. bahagia sesederhana itu, mar. sorry ya mar if you've felt uncomfortable pas kita di cie cie in, tapi to be honest aku senanggg wkwkwk, cuma ya...takut km risih ajaaa. bahagia terus ya, mar. ",4jakiC8ooA7viuPLqY8VEQ,Jodoh Pasti Bertemu,Afgan,https://i.scdn.co/image/ab67616d0000b273e801f28ee95c6c9a2cbac92a,2024-12-05T11:50:41.103913996+07:00
6750a3ce48d1613d5f267bac,damar,"hi damar! i hope it reaches you well and i hope you’re doing fine! sampe beberapa waktu lalu rasanya gue masih sempet kepikiran skenario-skenario “what if” di SMA, hence this song will always reminds me of you hoho. this is one of my most favorite songs, which turns out it is one of yours too. makin dipikir2, gue makin sadar kalo we share a lot in common, nggak cuma ulang tahun dan selera lagu aja yang sama, tp lo bener-bener kayak gue versi cowok.. apa krn ulang tahun bareng itu ya? t___t i really want to get closer and be friends karena kita satu selera, tapi karena track record kita di SMA yang udah terlanjur awkward itu gue juga jadi nggak berani approach duluan so here i am (setel musik clownery) HAHAHAHA anyway, if you’re reading this and you know who i am, please give a sign!! (tp jangan direct ya gw gak tau mau ditaro mana ini muka gw???) and happy early birthday!",21acb66djKRlDPJOXRBCkc,Take A Chance With Me,NIKI,https://i.scdn.co/image/ab67616d0000b273d3997a4c208ac08dafff374f,2024-12-05T01:47:42.252642892+07:00
675072dc48d1613d5f2662d6,damar,maaf..mar,68FHdrL6dbruEBrfLjR52a,Paths,NIKI,https://i.scdn.co/image/ab67616d0000b2734d3d3963c551df56736050f1,2024-12-04T22:18:52.035544427+07:00
67502c4748d1613d5f262c51,damar,ihacoy kakkk,77vx7sGjdqwdnQL968t8oY,Monolog,Pamungkas,https://i.scdn.co/image/ab67616d0000b27304d4b84c6eb6b24d61bbd963,2024-12-04T17:17:43.516772874+07:00
6750234c48d1613d5f26276b,damar,"i like you, semoga kamu suka aku balik.. ",1lCv3fOI9bqBypLpgUfA4T,Jadi Kekasihku Saja,Keisya Levronka,https://i.scdn.co/image/ab67616d0000b273831d62cd9ca98fefdbc8a680,2024-12-04T16:39:24.095884746+07:00
674f034f48d1613d5f25ba3f,damar,bingung gini,5jgFfDIR6FR0gvlA56Nakr,Blackbird - Remastered 2009,The Beatles,https://i.scdn.co/image/ab67616d0000b2734ce8b4e42588bf18182a1ad2,2024-12-03T20:10:39.282953369+07:00
674efa7848d1613d5f25b263,damar,if we loved again i swear i'd love u right,79uDOz0zuuWS7HWxzMmTa2,Back To December (Taylor's Version),Taylor Swift,https://i.scdn.co/image/ab67616d0000b2730b04da4f224b51ff86e0a481,2024-12-03T19:32:56.785284894+07:00
674ef7eb48d1613d5f25b045,damar,"haloo kaa damarrree, tolong maafinn kesalahan aku ya kaakk, maaf banget kalo aku buat kesalahan yang sama dan berulang kali. aku harap kamu mau maafinn aku dan hubungan kita awet kaaa, salam jauh dari pacarmu yang cantik ini well👊",7iTF9T1jum3Km6H6WMZpDC,One Only,Pamungkas,https://i.scdn.co/image/ab67616d0000b27304d4b84c6eb6b24d61bbd963,2024-12-03T19:22:03.916019514+07:00
674ef6aa48d1613d5f25af31,damar,balikan yu,0fTfyV8hSpqPHbOXqZsL6K,Forever Young,Alphaville,https://i.scdn.co/image/ab67616d0000b273aa36855383a263b4e21bda10,2024-12-03T19:16:42.171543747+07:00
674eae2e48d1613d5f258304,damar,Haii sayang,0zAtj0BEvpulETGrk95NPQ,Rayuan Perempuan Gila,Nadin Amizah,https://i.scdn.co/image/ab67616d0000b27394847679fe7b10e27d9803f5,2024-12-03T14:07:26.586667435+07:00
674e053848d1613d5f25581b,damar,"hi, kenapa kamu lucu banget? aku harap aku gak ngeganggu kamu ya!",4XEJR0jb29elGda86cL0IK,Am I Bothering You?,Reality Club,https://i.scdn.co/image/ab67616d0000b273c607bcd8355681ab4fac2968,2024-12-03T02:06:32.962602697+07:00
674ddeb848d1613d5f25487b,damar,"kak damaaaar, aku kangen bangeeeet. even kita tiaap hari ketemu di sekolah tapi tetep ajaaa aku kangeeen. maaf ya kalo aku bikin kaka risih, taapi jujur aku masih nunggu kakak disiniii. padahal kaakak janji mau ngajak aku nonton, tapi ternyaata malah kakak yang ngejauh duluan wkwkwkwk. gapapaa, better kayak gini daripada kakak harus boongin perasaan kakak sendirii. may god always bless u, kak damar",08PdFBcXzpkn1cWNgmKqhn,Promise,Laufey,https://i.scdn.co/image/ab67616d0000b27374c732f8aa0e0ccbb3d17d96,2024-12-02T23:22:16.320415271+07:00
674d9e4648d1613d5f250ada,damar,"hallo damar, setelah awal pertemuan itu, aku selalu menyangkal kalo aku tuh engga bakal suka sama kamu, aneh banget masa langsung suka?!?!. tapi ternyata setelah hampir 3 tahun lamanya, perasaan ini masih tersusun rapih disini. banyakkk banget yang mau aku ceritain ke kamu... damar, i hope u text me first hahaha. tapi kayanya engga mungkin deh, soalnya respon kamu kaya engga mau banget ada aku di hidupmu, aku ganggu banget ya? maaf... eh kenapa jadi sedih ya :((
",1IpJu8YwAlc1ozSxXAyxl8,Gemuruh Riuh,Mighfar Suganda,https://i.scdn.co/image/ab67616d0000b2731a6ff2bb48675dfdfbab4789,2024-12-02T18:47:18.316967575+07:00
674d26f948d1613d5f24d0fd,damar,"sayang kamu teruss, jangann sampee putuss yaa aku benerr benerr sayangg kamuu walaupun kamuu jarangg onn akuu tetappp nungguinn kamuu ",22bPsP2jCgbLUvh82U0Z3M,The Way I Loved You (Taylor’s Version),Taylor Swift,https://i.scdn.co/image/ab67616d0000b273a48964b5d9a3d6968ae3e0de,2024-12-02T10:18:17.358955772+07:00
674c996348d1613d5f24b053,damar,"DRB 
haloo sayyy pasti tau dongs aku siapa, gimana kabar kamu sekarang aku harap kamu lebih bahagia ya sekarang. jujur sayy aku Masi sering moment"" kita walaupun cuman sebentar tapi berkesan bgt, seharunya waktu kamu bilang mau ngajak balik aku iyain aja waktu itu:( ",4AhWZsG1kb8URNISpRRv9S,Kala Cinta Menggoda,Chrisye,https://i.scdn.co/image/ab67616d0000b273875283b08596b91b413d70fb,2024-12-02T00:14:11.142347351+07:00
674c50c748d1613d5f246a5e,damar,"semoga hubungan kitaa yang sekarang lebih lamaa selamanya, jangan sia""kan kesempatan kedua ini yaa sayang🤍🤍",74VkvVFBHn4RLxCGF3WBYu,Pilihan Hatiku,Lavina,https://i.scdn.co/image/ab67616d0000b273ebddd3737e07e301bf86f47f,2024-12-01T19:04:23.823498127+07:00
674bff4948d1613d5f2430ea,damar,"Hi..
Are u reading this?

Aku adalah orang yang kamu tau.
Kurasa tak perlu kusebutkan berapa lama kita telah saling tahu 'nama' satu sama lain.
Aku hanya ingin mengakui tentang..
sesuatu yang di kehidupan nyata aku mungkin tak akan pernah mengatakannya,
tapi, sepertinya aku juga tetap tak bisa mengatakannya di tulisan ini.
Beberapa tahun aku menyangkal perasaan ini.
Dan hari itu, tak bisa kulakukan lagi.
Sampai detik ini.

Mungkin lagu ini bisa menyampaikannya padamu..

Semangat ya, aku tau kamu sehebat itu.
Banyak hal bisa melukaimu dan jika tak ada yang mau mendengarmu, katakan semuanya setelah sujudmu.
Ia tau dirimu bahkan melebihi dirimu sendiri.

You wouldn't know who I am.
Or you would?",50x1Ic8CaXkYNvjmxe3WXy,Those Eyes,New West,https://i.scdn.co/image/ab67616d0000b2731bb5dc21200bfc56d8f7ef41,2024-12-01T13:16:41.763258113+07:00
674b2b2848d1613d5f23c9c3,damar,hari ini aku masih kangen kamu :(,6VggIDYOnf9C8fJVcMpxAu,Kangen,Dewa 19,https://i.scdn.co/image/ab67616d0000b27370ea19fd1f517d40b9c01c0d,2024-11-30T22:11:36.574882254+07:00
674b224248d1613d5f23bf52,damar,stop ngerokok sama minum minum nya yaa ☹️ aku disini sedih tiap liat kamu ngelakuin itu semua apalagi kmu gmau jujur ke aku 😞☹️☹️😩,38xWaVFKaxZlMFvzNff2aW,Breakeven,The Script,https://i.scdn.co/image/ab67616d0000b273b526ba531c80ed208cd428ed,2024-11-30T21:33:38.66395727+07:00
674aea6b48d1613d5f2389de,damar,"EH DAMAR, lu bisa gasih gausa ganggu gua mulu, ngeselin jir, jail parah lu ",0O0bttAxJKKWqAqY2Nq4mC,Falling In Love,Cigarettes After Sex,https://i.scdn.co/image/ab67616d0000b273fd275af89cec73d6287f9cbf,2024-11-30T17:35:23.465492815+07:00
674aaeda48d1613d5f23612b,damar,bocil,5tyGpIXFvaSwfCx2A82rR8,Goyang Dumang,Cita Citata,https://i.scdn.co/image/ab67616d0000b2735f574c2c194f3fe04b6c4b02,2024-11-30T13:21:14.125065612+07:00
674872ee48d1613d5f227ba8,damar,kamu beneran ga ngucapin aku ya? :(((,75JFxkI2RXiU7L9VXzMkle,The Scientist,Coldplay,https://i.scdn.co/image/ab67616d0000b273de09e02aa7febf30b7c02d82,2024-11-28T20:41:02.463742744+07:00
67472a4948d1613d5f2201e3,damar,"sayangg aku beruntung bisa kenal samaa kamu, aku bersyukur banget, aku berharap cinta kamu ke aku gaakan pernah habiss, akuu sayang samaa kamuu, kamuu ganteng, kamu baik, i love u more sayangkuu🤍🤍",2UgCs0i0rNHUH2jKE5NZHE,Sempurna,Andra & The Backbone,https://i.scdn.co/image/ab67616d0000b2730df7dec70511dd4f2e69dc34,2024-11-27T21:18:49.466205209+07:00
6747193848d1613d5f21f38e,damar,"aku harap kamu tau aku selalu mengusahakan semuanya buat kamu, sabar aku ke kamu gaperna habis, aku gaperna bisa marah sama kamu, semua kesalahan kamu selalu aku maafin, aku selalu belain kamu di depan temen aku, aku selalu inget sisi baik kamu, kamu tau engga aku se sayang ini? aku gapapa kalau harus perbaiki terus terusan asal sama kamu, maaf ya kalau aku memang masi belum cukup buat kamu. aku selalu takut buat kehilangan kamu, sayang. aku harap kamu juga begitu",7wlfGt5NkpPT6nRC6yCr7u,"Bercinta Lewat Kata - From ""Jatuh Cinta Seperti di Film-Film""",Donne Maula,https://i.scdn.co/image/ab67616d0000b2735d9740b9156bf12d23ba1bad,2024-11-27T20:06:00.714564263+07:00
6746e3e848d1613d5f21cfbe,damar,"bisa aja kelakuannya bikin aku baper, tpi itu berlaku ke semua orang, kamu kan friendly",4sJmv194lQKWjytpaxH1Vj,Separuh Aku,Noah,https://i.scdn.co/image/ab67616d0000b273ef9c61634ef59e7ee439dacc,2024-11-27T16:18:32.483671446+07:00
6746b78948d1613d5f21bb6d,damar,"Maaf klo lebay, tapi aku pgn cerita dsini.
Aku jg gatau kenapa bisa sesuka itu sm kmu mar. Setiap kali aku papasan sm kmu rasanya deg deg an bgt salting pgn senyum tapi selalu aku tahan biar kmu ga risih tiap ketemu aku. Padahal kita sama sekali gapernah komunikasi atau berinteraksi saling nyapa aja gapernah. Rasanya aku mau udahin aja perasaan ini ke kmu tapi aku gabisa. Aku gabisa maksa berhentiin rasa suka ini. Nyesek sih tiap kali ngeliat ada cewe yang suka jg sm kmu karena km emang sepopuler itu di sekolah. Tapi gapapa kok, aku bakalan simpen perasaan ini untuk kmu sampe rasanya ilang sendiri yaa. Maaf kalo bikin km risih.",7ADK1rnMzP6PGWhoqWirBJ,Pupus,Dewa,https://i.scdn.co/image/4998f20672f6783f7448f1266973a9e0595d5ea5,2024-11-27T13:09:13.608919382+07:00
6746b0bb48d1613d5f21b894,damar,damaar,4rHZZAmHpZrA3iH5zx8frV,Mirrors,Justin Timberlake,https://i.scdn.co/image/ab67616d0000b273db1d1cdc927a07825a2ed244,2024-11-27T12:40:11.339152205+07:00
6746ad2048d1613d5f21b738,damar,haii ka damar. maaf ya kalo kamu risih. soalnya temen aku manggil kamu terus setiap kamu lewat kelas aku. jujur kemaren aku takut kamu marah gara-gara risih,6PpkGvvtmLahruv3sttVzw,Please Forgive Me (Classic Version),Bryan Adams,https://i.scdn.co/image/ab67616d0000b273f3aa1a682c2d3360ec3d9523,2024-11-27T12:24:48.112163019+07:00
6746ac7648d1613d5f21b6f2,damar,"udaa gamtenkk , manis, tinggi, ternyata kulkas 500jt pintu ",4zRZAmBQP8vhNPf9i9opXt,8 Letters,Why Don't We,https://i.scdn.co/image/ab67616d0000b273b503cdb444b28826c4ca9217,2024-11-27T12:21:58.13536114+07:00
6745ec3748d1613d5f217aa2,damar,"CAN YOU PLEASE PUT AN EMOJI OR YOUR INITIAL IF YOU'RE GONNA LEAVE A MESSAGE FOR ME?! or use LANY's songs cuz yk i <3 them so much

— yup this is me, if ykyk",6OcCk1dbAb7XNHsC098oEM,I Quit Drinking,"Kelsea Ballerini, LANY",https://i.scdn.co/image/ab67616d0000b273b0be5e7275db8b7baa1ef779,2024-11-26T22:41:43.510532943+07:00
6745e6ae48d1613d5f217618,damar,🖕,64oWLmeRfpTwiuxthP7yCe,playboy shit (feat. Lil Aaron),"blackbear, lil aaron",https://i.scdn.co/image/ab67616d0000b273432d3776e465c18512b49ef8,2024-11-26T22:18:06.124653055+07:00
6745d03a48d1613d5f21621e,damar,"hi, I know you feel confused bcs I avoiding you for some month until now. I did that because you did it first, you avoid me and don't want to talk about our problem face to face irl. it's kinda hurt because I can't stand with people who badmouthing me and doesn't do anything to make it better. I feel like you try to run from problem, it's kinda coward things to do y'know, that make you losing me. I wish you nothing but happiness, happy late birthday. ",6mXdCcFnPKQznj4CmMRmHC,Mean It,"Lauv, LANY",https://i.scdn.co/image/ab67616d0000b2732c0e1e9e1fd1e7b132da1606,2024-11-26T20:42:18.578593309+07:00
67459adc48d1613d5f21398e,damar,"sekalipun takdir tidak mempertemukan kita kembali lagi, aku harap kamu selalu bahagia di setiap prosesmu, aku tidak menyesal menyimpan perasaan ini padamu, walaupun akhirnya kita tidak lagi bersama, tapi kamu harus tau bahwa aku menyayangimu lebih dari kamu tau, tidak ada kebohongan apapun tentang perasaan ini, bahkan kepergianmu adalah suatu hal yang sangat aku sesali dalam hidup ini.    -tasya",4bf1MapeofdB3XKUqDMUOm,Kau Masih Kekasihku,NaFF,https://i.scdn.co/image/ab67616d0000b2739d16cb037e7c420c97292064,2024-11-26T16:54:36.268311516+07:00
6744652548d1613d5f20af07,damar,"I miss our old chats, but I don't think you care about ""us"" wkwk. tau gk? aku selalu nungguin balasan dari kamu, tiap saat aku selalu lihat ke hp berharap itu notif dari kamu, but it turns out that's not the case. tunggu aku capek ya, kalo aku udh capek nanti aku gk bakal ganggu kamu lagi, aku juga capek kalo harus terus""an nunggu kamu yang sikapnya berubah ubah wkwk",3nqqDo8CcCLke3ZoTgiOKf,The Man Who Can't Be Moved,The Script,https://i.scdn.co/image/ab67616d0000b273f33a9f529c12f79b116eb218,2024-11-25T18:53:09.487115318+07:00
6743baf648d1613d5f205f6a,damar,"mencintaimu adalah bagian terbaik dalam hidupku. Tapi disini aku yang salah, maaf ",5JESuE80fvausWHjcT9QVh,Aku Milikmu,Dewa 19,https://i.scdn.co/image/ab67616d0000b273bfc7fa507f4bc822cabe7bde,2024-11-25T06:47:02.991207552+07:00
6743b05548d1613d5f205d2e,damar,damar,5XeFesFbtLpXzIVDNQP22n,I Wanna Be Yours,Arctic Monkeys,https://i.scdn.co/image/ab67616d0000b2734ae1c4c5c45aabe565499163,2024-11-25T06:01:41.813512952+07:00
674334e248d1613d5f20243a,damar,damar,09eWF5r8kasfOEp8RFRQLv,Serana,For Revenge,https://i.scdn.co/image/ab67616d0000b27366de8f7224e459d2cc0f9a1f,2024-11-24T21:14:58.201049206+07:00
6742d6f548d1613d5f1fd494,damar,"haii kakk damar 8c smpn 3, akuu sukaa samaa kamuu kaa maaff yaa kaloo bikinn kamuu risihh. akuu suka kamuu bukan karna muka kamuu kaa, tapii karna sifatt kamuu. ohh iyaa kamuu tauu nggaa kaa?? kaloo kamuu tuhh bedaa banget sama yang lainn, kamuu tuh kayaa bedaa bangett di sama cowo yang lain soalnyaa cowo lainn nakall smuaa tapii kamuu enggaa. semogaa kamuu liatt inii yaa kaa damarr🙁🙁",736PP5LTtREkDgktNmX3Gu,Superpowers,Daniel Caesar,https://i.scdn.co/image/ab67616d0000b2737c68face1dc58127f3a7b1cc,2024-11-24T14:34:13.127177054+07:00
6742c56f48d1613d5f1fc9a0,damar,"semoga hubungan kita bertahan lama
-clarissa",5LrN7yUQAzvthd4QujgPFr,Here With Me,d4vd,https://i.scdn.co/image/ab67616d0000b27364fa1bda999f4fbd2b7c4bb7,2024-11-24T13:19:27.569250896+07:00
6742c51948d1613d5f1fc962,damar,"hi, i love u in every universe",1RMJOxR6GRPsBHL8qeC2ux,Best Part (feat. H.E.R.),"Daniel Caesar, H.E.R.",https://i.scdn.co/image/ab67616d0000b2733138f891f3075c9c5d944037,2024-11-24T13:18:01.727950185+07:00
6741fab348d1613d5f1f6efc,damar,lu kea anjing selingkuh ,7FYH5AW3bVfZHJIQpq3UOA,I Don't Fuck With You,"Big Sean, E-40",https://i.scdn.co/image/ab67616d0000b27350192d5f728fea13fb3af203,2024-11-23T22:54:27.357715603+07:00
6741f94e48d1613d5f1f6d8e,damar,"Idk, kmu liat ini atau ga hahaha, i just want to let u know that IM SOOO GRATEFULL TO MEET U, hope we can spend more time together, I wish, idk abt ur wishes. This past few weeks I've been wondering, kmu bakal chat ga ya, or kmu lgi apa ya hahaha. Thank youu for coming to my life ya, lemme know abt ur wishes😊 maybe i'll just wait. 

Anw i use this song cuz u said that u like this band, dan karena lagu yg kamu suka gatau kenapa ga ada di sini, jdi aku pake lagu yang aku suka tp dengan band yang sama☺️",6Npkwd5gv61SR6QZbTyNf9,Lampu Kuning,Juicy Luicy,https://i.scdn.co/image/ab67616d0000b273fadca79809c06f6afe7de0d9,2024-11-23T22:48:30.003342871+07:00
6741ea3f48d1613d5f1f5ce5,damar,"stop ngasi mixed signal bro, kalo bukan aku yg kamu mau, jgn bawa aku terlalu jauh. jujur bingung bgt sama sikap kamu yg plin plan itu:(",0IsAEXwuy46qn0bbJYdWIH,Mixed Signals,Ruth B.,https://i.scdn.co/image/ab67616d0000b27397e971f3e53475091dc8d707,2024-11-23T21:44:15.327075519+07:00
6741e3f248d1613d5f1f55e4,damar,"Aku unfollow instagram mu hari ini, abis ini gaada kabar yg bisa ku intip dr igmu ya kan, impulsive saja sih🤡, chat kita juga aku udh apus mar, bener bener ya we already remove each other from our lives, duh agak nyesel unfollow lah tp gapapalah biar kebiasa",530l1XggFTVKZIM3khE10r,Lose,NIKI,https://i.scdn.co/image/ab67616d0000b27359c7637acca66e35930f4b14,2024-11-23T21:17:22.885957697+07:00
6741da0148d1613d5f1f4b1b,damar,haii kaka,5VBjyOQzqlPNgdRPMM6prF,seasons,wave to earth,https://i.scdn.co/image/ab67616d0000b2733f203b8d0d8e54fab416a825,2024-11-23T20:34:57.4851672+07:00
6741c35e48d1613d5f1f33db,damar,"i like u too, but i can't say it cuz aku gamau kita ada hubungan. aku berpegang teguh sama prinsip aku yang gaakan pacaran seumur hidup, even if we're just ""hts"" atau chattan tiap hari, i think ini bisa dianggap pacaran. so, mungkin in another life, ya?",6GCW5Muk3u0cM5QTkS4C9a,The One That Got Away,Katy Perry,https://i.scdn.co/image/ab67616d0000b27343219fb4e2c45a0b7df6ef87,2024-11-23T18:58:22.037810495+07:00
6741b8cf48d1613d5f1f2a3b,damar,"gue udah suka sama lo dari lama, mar. semenjak kita jadi partner.",0rgEL2cD2T5MDzSDJTQNlw,Jatuh Hati,Raisa,https://i.scdn.co/image/ab67616d0000b273f018e2376d8060e0ba1112ab,2024-11-23T18:13:19.95311589+07:00
6741478748d1613d5f1ee0bc,damar,"Halo Dam, apa kabar? Semoga lo selalu dalam keadaan baik dan sehat ya. Gua cuma mau bilang terima kasih, karena lo udah mau berteman sama gue dan sempat jadi teman bertukar cerita gue walaupun cuma sebentar hehe. Oh iya, i also have a confession to make... jadi sebenernya gue udah naksir sama lo dari lama, kayaknya sejak awal kita kenalan deh. Tapi gue sadar diri karena yg naksir sama lo banyak dan kita juga gak pernah ketemu irl 😣 kalau dipikir-pikir lagi, gue jg kayaknya belum pantas buat lo ☹️ lo kan lucu, pintar, friendly, rajin, baik, siapa coba yang gak naksir sama lo? Jadi gue cuma berharap semoga suatu saat nanti kita bisa bertemu ya, bagaimanapun caranya. Ps. Kurangin ngopinya Dam, kasian tuh lambung lo wkwk",1i9iliTpiPLizleapSg37I,Untitled,MALIQ & D'Essentials,https://i.scdn.co/image/ab67616d0000b273f2efc87da4a2ede08c0c2322,2024-11-23T10:09:59.801213664+07:00
6740b8c048d1613d5f1eb36a,damar,"[30/8 21.27] d: kamu mau req lagu gak aku mau main gitar, nnti tapi
[30/8 21.29] .: hmm apa yaa??
[30/8 21.29] d: terserah km
masi inget ga???
lucu ya kita sebelum aku tau kamu punya cewe wkwk",66V6QeI1Y9PQO4J7p7JGJO,Lebih Indah,Adera,https://i.scdn.co/image/ab67616d0000b273f2dcbff793a8e4ba321e2fa7,2024-11-23T00:00:48.268979872+07:00
674097eb48d1613d5f1e961a,damar,"salah ya kalo kmren aku isi pesan kya gitu??, kalo emng isi pesan kmren ga realate ngapain harus ngilang lagi??, apa bener ya feeling aku",7LVHVU3tWfcxj5aiPFEW4Q,Fix You,Coldplay,https://i.scdn.co/image/ab67616d0000b2734e0362c225863f6ae2432651,2024-11-22T21:40:43.522786535+07:00
6740942548d1613d5f1e9202,damar,"sebenarnya ga kaget kalo kamu langsung punya orang baru, tpi emang kenangan yang kemarin itu gaada artinya ya? -ale (lele) ",13sOb9V6Y3uCnRxY9HIZqP,if u could see me cryin' in my room,"Arash Buana, raissa anggiani",https://i.scdn.co/image/ab67616d0000b2735f95e95fefcbafd47ffd6130,2024-11-22T21:24:37.78999769+07:00
674091c048d1613d5f1e8f16,damar,:(,0c9kI2G2rtBJ9Z2VYLD8k2,Menunggumu,Noah,https://i.scdn.co/image/ab67616d0000b27316b4cae477950bd1a0508f40,2024-11-22T21:14:24.377020402+07:00
6740851c48d1613d5f1e7fe4,damar,mati aja sana lu kontol ,3L5gk3sesbQIvymuKbImuM,Ratna Anjink,"Lil Salmonela, Lil Kujang",https://i.scdn.co/image/ab67616d0000b2739edf705ff97263e916f8dfbb,2024-11-22T20:20:28.691996879+07:00
6740814d48d1613d5f1e7b7c,damar,"buat damarjati anak pk itu kalau gabisa dimilikin tolong jangan ganteng² pls, you look so handsome with your new haircut bro ugh 😨😨",6Nle9hKrkL1wQpwNfEkxjh,Chanel,Frank Ocean,https://i.scdn.co/image/ab67616d0000b273a0b780c23fc3c19bd412b234,2024-11-22T20:04:13.805646311+07:00
67406b3248d1613d5f1e63f9,damar,imysm,6embPWj9qvusLg9JpbAmCQ,Losing Us.,raissa anggiani,https://i.scdn.co/image/ab67616d0000b2735f29dacdd47445d10d5b9ae1,2024-11-22T18:29:54.135576735+07:00
6740345048d1613d5f1e3b58,damar,"Aku harap kamu cowo ya ka ,akh takut ketipu 


I love u ka",4SqWKzw0CbA05TGszDgMlc,I Love You So,The Walters,https://i.scdn.co/image/ab67616d0000b2739214ff0109a0e062f8a6cf0f,2024-11-22T14:35:44.361277144+07:00
6740244748d1613d5f1e32bd,damar,damarr aku kangen kamuu tauu,0J7eKnQIrajXmR5VePSvTx,Aku Disini Untukmu,"MALIQ & D'Essentials, Dewa 19",https://i.scdn.co/image/ab67616d0000b27366254746bcef77df47b04006,2024-11-22T13:27:19.542635903+07:00
673fc67748d1613d5f1e0db0,damar,"Selamat ulang tahun yang ke 17, meski jarak kita udah kerasa jauh sekali tapi aku masih ingat kokk, i miss you, always. Jangan lupa berusaha dengan mimpi mimpimu itu yaa, kau ngeselin bngt sih most of the time, tapi nyatanya aku tetap ada disini kan????? Ga kehitung berapa kali aku udh bilang kalo aku kangen kau. Tapi aku berusaha biasa dengan hal ini, sadar diri aja sih, but this letter its not about me its about you, semoga bisa ke Jepang kapan kapan owkayyyyy, tapi plis jngn jadi wibu freakkk dehhhhh dan semoga kau bisa jadi lebih more educated hahahahaha, belajar yang rajin ya or just do your best at everything u might love okayyyy
Maybe we can meet again at our best selves?
",68FHdrL6dbruEBrfLjR52a,Paths,NIKI,https://i.scdn.co/image/ab67616d0000b2734d3d3963c551df56736050f1,2024-11-22T06:47:03.986515334+07:00
673ef58748d1613d5f1d83ed,damar,"hi fav strangers, akuu berharapp kamu liat catatan aku ini ya? kamu makin lama makin cakepp aja!! btw ak masi ga bisa lupain kamu, aku nyimpen kamu di lagu about you dari dlu, kamu pernah kangen sama aku ga ya? atau emangg km uda ada pengganti buat aku? hahah have a nice day bro",1fDFHXcykq4iw8Gg7s5hG9,About You,The 1975,https://i.scdn.co/image/ab67616d0000b2731f44db452a68e229650a302c,2024-11-21T15:55:35.750610968+07:00
673e9b4a48d1613d5f1d5939,damar,"HALOO DAMAR INI AKUUU, AKU CUMA MAU BILANG KALAU AKU KANGEN KAMUU",0bJ7Fs6uqdILGFy8O7Stz7,Fall For You,Secondhand Serenade,https://i.scdn.co/image/ab67616d0000b2735cc5b5a10eaab8bea0206376,2024-11-21T09:30:34.147768529+07:00
673e870a48d1613d5f1d5104,damar,"aku tau hubungan kita uda berakhir tapi aku ga bisa boongin perasaan aku kalo aku masi sayang banget sama kamu. aku bakal nunggu kamu sampe kapan pun. kalo org baru nyakitin kamu. kamu bisa pulang ke aku sayang. aku akan selalu jadi rumah kamu. bahagia selalu sayang

#aku ce yg slalu kamu manggil endut yaitu rara",6dMXNAMr1dlAAUo53QKfqs,Kamu dan Kenangan - Original Soundtrack Habibie & Ainun 3,Maudy Ayunda,https://i.scdn.co/image/ab67616d0000b273544be370348763d9402f426a,2024-11-21T08:04:10.464644151+07:00
673e7c9648d1613d5f1d4d79,damar,andai kamu tau betapa susahnya berdamai dengan trauma dan trust issue.,0oHORi5WuqspXRYnQ5HA9b,Sekali Lagi,Ipang Lazuardi,https://i.scdn.co/image/ab67616d0000b273f12766e61dbc7b4cd5cd1283,2024-11-21T07:19:34.980761031+07:00
673e08ed48d1613d5f1d2643,damar,Sendiri,04mAOoQNsXmDJlyupJwmkO,Waiting Room,Phoebe Bridgers,https://i.scdn.co/image/ab67616d0000b2734869178d6ce3c0d488083f9d,2024-11-20T23:06:05.738137618+07:00
673dda1b48d1613d5f1ce947,damar,"kangen =((
bisa ngga kita chatan lagi? i miss you...

DBD.",5XeFesFbtLpXzIVDNQP22n,I Wanna Be Yours,Arctic Monkeys,https://i.scdn.co/image/ab67616d0000b2734ae1c4c5c45aabe565499163,2024-11-20T19:46:19.961809077+07:00
673dc29448d1613d5f1ccbba,damar,-,7Ib8QWig7J3uxW0gNdln3z,結言,Centimillimental,https://i.scdn.co/image/ab67616d0000b273b2711f388ee3bcebcb326eef,2024-11-20T18:05:56.161887575+07:00
673d758f48d1613d5f1c92ea,damar,"hai, 
sayang aku selalu berharap aku satu satunya tempat kamu pulang tempat kamu bersandar aku berharap aku orang bisa kamu ajak dalam segala hal tolong selalu libatkan aku tuntun aku cintai aku. 
tolong jangan libatkan perempuan lain dalam hubungan ini disaat aku mulai meyakinkan diriku untuk percaya(lagi)😩❤️‍🩹
damar i love you to the moon and back 


-u",3Lnf4aMMRSu80PqR5EWLza,I Love You So,The Walters,https://i.scdn.co/image/ab67616d0000b273ce233c1541dbcc3fa5f1e0fb,2024-11-20T12:37:19.222274036+07:00
673ce29e48d1613d5f1c5c47,damar,"0:32 - 0:47
Hrusnya lu tau si gua siapa hehe🤸‍♀️🤸‍♀️🤸‍♀️ maaf yh gua blm bisa moveon ternyata..pdhl gua udh berusaha bgt ngelupainny gua juga ga paham kenapa sampe segininya..maaf ya gua tolol bgt..tenang aj gua ga bakal being annoying lagi kok gua gaakan contact lo sampe kapanpun trus juga gua udh ngeremove lu dri socmed gua jdi lu gaakan ngeliat gua annoying lagi...gua bkl berusaha lagi buat lupain lo...sehat terus yh..jgn kangen gua wkwkwkwkkwkw...gatau sii itu send the song yg pake lagu kangen bnran dri lo atau bukan..semoga gua cuma halu aj. See you when i see you (maybe??)...klo misalnya lu butuh konfirmasi ini gua yg lu tau atau bukan lu bisa contact gua ya wkwkwwkwkkw eh tpi jgn deng nnti gua makin susah aja bjir moveonny...udh pkoknya see u in another kesempatan ( meskipun gua tau kesempatannya gaakan pernah ada) .",4Sav8RLaXMBpTZX6xNPj0K,Try Again,"JAEHYUN, d.ear",https://i.scdn.co/image/ab67616d0000b2733e3eb54b0842a353b2a7ec00,2024-11-20T02:10:22.270185812+07:00
